,user utc offset,text,created_at,user,id,user time zone,lng,user location,lat,language,Parsed,lemmas
732,,little kid: hi'what's your name----Napoles:I enbook my rightHAHAHAHA,1383888966.0,charlizedaphne,'398806132082241537',,,,,en,little kid: hi'what's your name----Napoles:I enbook my rightHAHAHAHA,"[little, kid, hi'what, 's, name----Napoles, enbook, rightHAHAHAHA]"
733,Philippines,"""@TagalogQuotes: My Amnesia Girl remake... starring, John Lloyd Cruz and Janet Napoles. #MyAmnesiaGirlDiKoPoAlam http://t.co/Np6dhYn0Bh""",1383888983.0,SydneyyyKeith,'398806204446539777',Pacific Time (US & Canada),,-28800.0,,en,"""@TagalogQuotes: My Amnesia Girl remake... starring, John Lloyd Cruz and Janet Napoles. #MyAmnesiaGirlDiKoPoAlam http://t.co/Np6dhYn0Bh""","[@TagalogQuotes, Amnesia, Girl, remake, starring, John, Lloyd, Cruz, Janet, Napoles, MyAmnesiaGirlDiKoPoAlam, http://t.co/Np6dhYn0Bh]"
734,My Domain.,"Meanwhile,rich politicians don't desrve pork barrel.If their service is genuine,they should be willing to use their own money for the pipol.",1383889039.0,lordcuntapay,'398806439260454912',Alaska,,-32400.0,,en,"Meanwhile,rich politicians don't desrve pork barrel.If their service is genuine,they should be willing to use their own money for the pipol.","[rich, politicians, n't, desrve, pork, barrel, service, genuine, willing, use, money, pipol]"
735,,@markglegaspi good morning mr napoles.,1383889152.0,akosiangeline,'398806912277291008',Hawaii,,-36000.0,,en,@markglegaspi good morning mr napoles.,"[@markglegaspi, good, morning, mr, napoles]"
736,"Brasilia, Brazil",Janet Lim Napoles got schooled: 7 killer quips from Senator Miriam Defensor Santiago http://t.co/q7GbDR8lij via @CoconutsManila,1383889157.0,RasheedsWorld,'398806936230969344',Brasilia,,-7200.0,,en,Janet Lim Napoles got schooled: 7 killer quips from Senator Miriam Defensor Santiago http://t.co/q7GbDR8lij via @CoconutsManila,"[Janet, Lim, Napoles, got, schooled, killer, quips, Senator, Miriam, Defensor, Santiago, http://t.co/q7GbDR8lij, @CoconutsManila]"
737,where happiness is ,"""@vicegandako: Napoles Wedding- Priest: Janet do you take this man to be your lawfully wedded husband? Janet: Di ko po alam!""",1383889182.0,Iamdirektyuners,'398807041998737408',Beijing,,28800.0,,en,"""@vicegandako: Napoles Wedding- Priest: Janet do you take this man to be your lawfully wedded husband? Janet: Di ko po alam!""","[@vicegandako, Napoles, Wedding-, Priest, Janet, man, lawfully, wedded, husband, Janet, Di, ko, po, alam]"
738,,"Let's play the singing beehost: ano sunod ng ""what does the fox say?"" Napoles: Di ko po alam",1383889247.0,charlizedaphne,'398807313173061633',,,,,en,"Let's play the singing beehost: ano sunod ng ""what does the fox say?"" Napoles: Di ko po alam","[Let, 's, play, singing, beehost, ano, sunod, ng, fox, Napoles, Di, ko, po, alam]"
739,Australia-Philippines,WHAT DOES NAPOLES SAY?I INVOKE MY RIGHT AGAINST SELF INCRIMATION,1383889282.0,maegangeli,'398807459147440128',Beijing,,28800.0,,en,WHAT DOES NAPOLES SAY?I INVOKE MY RIGHT AGAINST SELF INCRIMATION,"[NAPOLES, SAY?I, INVOKE, RIGHT, SELF, INCRIMATION]"
740,Camp Half Blood,Where can I watch the Replay of Janet Napoles' Hearing in Senate. ? :(,1383889287.0,SirGoodRose,'398807481628913665',Beijing,,28800.0,,en,Where can I watch the Replay of Janet Napoles' Hearing in Senate. ? :(,"[watch, Replay, Janet, Napoles, Hearing, Senate]"
741,Bulacan,YOLANDA meet Napoles.,1383889296.0,HindiBabaeroIto,'398807520132595712',Beijing,,28800.0,,en,YOLANDA meet Napoles.,"[YOLANDA, meet, Napoles]"
742,#sisigclique and #yellowpickle,"""Di ko po alam. I invoke my rights against self incrimination."" lol gagu utut mu napoles",1383889297.0,dropletsoflarry,'398807521378308099',Pacific Time (US & Canada),,-28800.0,,en,"""Di ko po alam. I invoke my rights against self incrimination."" lol gagu utut mu napoles","[Di, ko, po, alam, invoke, rights, self, incrimination, lol, gagu, utut, mu, napoles]"
743,Philippines,#NOWWATCHING---- JANET LIM NAPOLES HEARING AT THE SENATE ON PDAF PORK BARREL SCAM Part 3: http://t.co/wwDc74TczF via @youtube,1383889327.0,iamrhenzZ,'398807647723327488',Alaska,,-32400.0,,en,#NOWWATCHING---- JANET LIM NAPOLES HEARING AT THE SENATE ON PDAF PORK BARREL SCAM Part 3: http://t.co/wwDc74TczF via @youtube,"[NOWWATCHING----, JANET, LIM, NAPOLES, HEARING, SENATE, PDAF, PORK, BARREL, SCAM, http://t.co/wwDc74TczF, @youtube]"
744,Somewhere down the road,"""I invoke myself against self-discrimination."" @Z@R na Napoles! XD",1383889331.0,iPatriziaYuki,'398807665020645376',Beijing,,28800.0,,en,"""I invoke myself against self-discrimination."" @Z@R na Napoles! XD","[invoke, self, discrimination, @Z@R, na, Napoles, XD]"
745,@ jiyeon's heart 3,LOVE is what CHRISTMAS is all about. :) GOOG DAY :)#tiara #napoles #christmas :) :) :),1383889468.0,MhaiAsuncion,'398808237836754944',,,,,en,LOVE is what CHRISTMAS is all about. :) GOOG DAY :)#tiara #napoles #christmas :) :) :),"[LOVE, CHRISTMAS, GOOG, DAY, tiara, napoles, christmas]"
746,,@lantydhenise @lanceugalde no im not drunk! Im not napoles,1383889502.0,Oblenard,'398808381814632448',Singapore,,28800.0,,en,@lantydhenise @lanceugalde no im not drunk! Im not napoles,"[@lantydhenise, @lanceugalde, m, drunk, m, napoles]"
747,,"Hoy Napoles, laglag ka kay Miriam! 1) CLICK and JOIN: https://t.co/2ATuCmpoGn 2) CLICK and LIKE :... http://t.co/6czv9ht9qv",1383889508.0,BalitangBalita2,'398808407521910784',,,,,en,"Hoy Napoles, laglag ka kay Miriam! 1) CLICK and JOIN: https://t.co/2ATuCmpoGn 2) CLICK and LIKE :... http://t.co/6czv9ht9qv","[Hoy, Napoles, laglag, ka, kay, Miriam, CLICK, JOIN, https://t.co/2ATuCmpoGn, CLICK, LIKE, http://t.co/6czv9ht9qv]"
748,Philippines,"Napoles : "" you think you're safe na ? Muahahahahhaa ""Fuck.Told you people!!! She's responsible for this! It's her sacrificial revenge .",1383889521.0,CateBcbc,'398808460801761280',Alaska,122.55792199,-32400.0,10.71633122,en,"Napoles : "" you think you're safe na ? Muahahahahhaa ""Fuck.Told you people!!! She's responsible for this! It's her sacrificial revenge .","[Napoles, think, 're, safe, na, Muahahahahhaa, Fuck, Told, people, 's, responsible, 's, sacrificial, revenge]"
749,Philippines,@AyyyGrabe: Arnold Clavio and Janet Napoles http://t.co/y2UPVxmHr2 Made my night!!,1383889522.0,beverlyodz,'398808468213100545',Hong Kong,,28800.0,,en,@AyyyGrabe: Arnold Clavio and Janet Napoles http://t.co/y2UPVxmHr2 Made my night!!,"[@AyyyGrabe, Arnold, Clavio, Janet, Napoles, http://t.co/y2UPVxmHr2, night]"
750,Flying through the Galaxy ,"""@PanirangCaption: I invoke my right with a big smile ... http://t.co/iws9wfkqeN"" well fck u napoles",1383889525.0,abyglmrno,'398808477704806400',International Date Line West,,-39600.0,,en,"""@PanirangCaption: I invoke my right with a big smile ... http://t.co/iws9wfkqeN"" well fck u napoles","[@PanirangCaption, invoke, right, big, smile, http://t.co/iws9wfkqeN, fck, u, napoles]"
751,,@thedankid well yOU SAID I LOOKED LIKE NAPOLES U BUTT,1383889543.0,prestiine,'398808552187260928',Beijing,,28800.0,,en,@thedankid well yOU SAID I LOOKED LIKE NAPOLES U BUTT,"[@thedankid, yOU, SAID, LOOKED, LIKE, NAPOLES, U, BUTT]"
752,,Miriam to Napoles: Tell the TRUTH before the SENATORS affected will have you ASSASSINATED 1) CLICK AND JOIN &gt;&gt;&gt;... http://t.co/IbvKVuOPes,1383889549.0,BalitangBalita2,'398808579475382272',,,,,en,Miriam to Napoles: Tell the TRUTH before the SENATORS affected will have you ASSASSINATED 1) CLICK AND JOIN &gt;&gt;&gt;... http://t.co/IbvKVuOPes,"[Miriam, Napoles, Tell, TRUTH, SENATORS, affected, ASSASSINATED, CLICK, JOIN, gt;&gt;&gt, http://t.co/IbvKVuOPes]"
753,,Napoles denies any involvement in PDAP PORK BARREL FUND SCAM. Miriam in award-winning performance. 1) CLICK AND... http://t.co/Li5aEbk6vE,1383889574.0,BalitangBalita2,'398808685247750144',,,,,en,Napoles denies any involvement in PDAP PORK BARREL FUND SCAM. Miriam in award-winning performance. 1) CLICK AND... http://t.co/Li5aEbk6vE,"[Napoles, denies, involvement, PDAP, PORK, BARREL, FUND, SCAM, Miriam, award, winning, performance, CLICK, http://t.co/Li5aEbk6vE]"
754,Narnia. ,@pancitantonio @kimadrift Napoles is that you? HAHAHAHA,1383889618.0,SuzieAngel97,'398808868756525056',Kuala Lumpur,,28800.0,,en,@pancitantonio @kimadrift Napoles is that you? HAHAHAHA,"[@pancitantonio, @kimadrift, Napoles, HAHAHAHA]"
755,,I invoke my rights against self incrinimition..:DGood nightNapoles style.,1383889633.0,Gilemperador,'398808932040187904',,,,,en,I invoke my rights against self incrinimition..:DGood nightNapoles style.,"[invoke, rights, self, incrinimition, :DGood, nightNapoles, style]"
756,,2 thumbs up for NAPOLES!!! #CertifiedSikat http://t.co/PSvlmjJykH,1383889675.0,kennagwapahan,'398809106456510464',Alaska,,-32400.0,,en,2 thumbs up for NAPOLES!!! #CertifiedSikat http://t.co/PSvlmjJykH,"[thumbs, NAPOLES, CertifiedSikat, http://t.co/PSvlmjJykH]"
757,PHILIPPINES,"Rappler Newscast: Yolanda PH, pork barrel, HK and Manila | Watch: http://t.co/DGxp1e7V8P via Rappler",1383889752.0,BalitaNgayon,'398809428969136128',,,,,en,"Rappler Newscast: Yolanda PH, pork barrel, HK and Manila | Watch: http://t.co/DGxp1e7V8P via Rappler","[Rappler, Newscast, Yolanda, PH, pork, barrel, HK, Manila, |, Watch, http://t.co/DGxp1e7V8P, Rappler]"
758,"Milky Way Galaxy, Earth","""@laslasnafriend: Smile smile din pag may crime. #Napoles http://t.co/4fkkSe9xlB""",1383889783.0,itsElishaGallo,'398809561731055617',Beijing,,28800.0,,en,"""@laslasnafriend: Smile smile din pag may crime. #Napoles http://t.co/4fkkSe9xlB""","[@laslasnafriend, Smile, smile, din, pag, crime, Napoles, http://t.co/4fkkSe9xlB]"
759,"MNL, PHL",Just a thought.. Napoles won't stand a chance in Pinoy Henyo 'cause she doesn't know anything.,1383889799.0,jomskiii,'398809629813002240',Hong Kong,,28800.0,,en,Just a thought.. Napoles won't stand a chance in Pinoy Henyo 'cause she doesn't know anything.,"[thought, Napoles, wo, n't, stand, chance, Pinoy, Henyo, 'cause, n't, know]"
760,Manila,"""Smile smile din pag may crime""- Napoles. ",1383889827.0,Phamelacamram,'398809747052195841',Alaska,,-32400.0,,en,"""Smile smile din pag may crime""- Napoles. ","[Smile, smile, din, pag, crime""-, Napoles]"
761,VIP,convo with my friends about napoles senate hearing was funny as shit earlier xD,1383889849.0,giyongchy94,'398809837972115456',Singapore,,28800.0,,en,convo with my friends about napoles senate hearing was funny as shit earlier xD,"[convo, friends, napoles, senate, hearing, funny, shit, earlier, xD]"
762,,I invoke my right against self-incrimination. -NApoles haha,1383889851.0,GraceDeeGee,'398809845438377984',,,,,en,I invoke my right against self-incrimination. -NApoles haha,"[invoke, right, self, incrimination, -NApoles, haha]"
763,Under the sea,Obvious masyado na your stressed. You look like Napoles.,1383889880.0,ElizeLabao,'398809966003240960',,,,,en,Obvious masyado na your stressed. You look like Napoles.,"[Obvious, masyado, na, stressed, look, like, Napoles]"
764,PHILIPPINES,Napoles transfer to regular jail up to court http://t.co/b9J1BybeJy via InquirerNET,1383889886.0,BalitaNgayon,'398809994596220928',,,,,en,Napoles transfer to regular jail up to court http://t.co/b9J1BybeJy via InquirerNET,"[Napoles, transfer, regular, jail, court, http://t.co/b9J1BybeJy, InquirerNET]"
765,PHILIPPINES,MTRCB summons Arnold Clavio for rude language against Napoles lawyer http://t.co/mGvV7YDszZ via InquirerNET,1383889889.0,BalitaNgayon,'398810005337804800',,,,,en,MTRCB summons Arnold Clavio for rude language against Napoles lawyer http://t.co/mGvV7YDszZ via InquirerNET,"[MTRCB, summons, Arnold, Clavio, rude, language, Napoles, lawyer, http://t.co/mGvV7YDszZ, InquirerNET]"
766,Quezon City,"President @noynoyaquino , pls bring #Napoles 2 a regular jail. She won't cooperate. Why waste P150k each time she goes out of Sta Rosa?",1383889901.0,farrahgutierrez,'398810056335978497',Singapore,,28800.0,,en,"President @noynoyaquino , pls bring #Napoles 2 a regular jail. She won't cooperate. Why waste P150k each time she goes out of Sta Rosa?","[President, @noynoyaquino, pls, bring, Napoles, regular, jail, wo, n't, cooperate, waste, P150k, time, goes, Sta, Rosa]"
767,,"You Napoles, tell the truth before you get assassinated by the masterminds! Sen. Miriam Defensor Santiago said",1383889909.0,litlynvistal,'398810091329421312',Pacific Time (US & Canada),,-28800.0,,en,"You Napoles, tell the truth before you get assassinated by the masterminds! Sen. Miriam Defensor Santiago said","[Napoles, tell, truth, assassinated, masterminds, Sen., Miriam, Defensor, Santiago, said]"
768,CITY OF LOVE ,Will watch Napoles' interview again!,1383889941.0,TinnyJaay,'398810221956452352',Pacific Time (US & Canada),,-28800.0,,en,Will watch Napoles' interview again!,"[watch, Napoles, interview]"
769,,"""@vicegandako: Napoles Wedding- Priest: Janet do you take this man to be your lawfully wedded husband? Janet: Di ko po alam!""",1383889965.0,jllnbtst,'398810322493898753',Beijing,,28800.0,,en,"""@vicegandako: Napoles Wedding- Priest: Janet do you take this man to be your lawfully wedded husband? Janet: Di ko po alam!""","[@vicegandako, Napoles, Wedding-, Priest, Janet, man, lawfully, wedded, husband, Janet, Di, ko, po, alam]"
770,,Ring-ding-ding-ding-dingeringeding! Gering-ding-ding-ding-dingeringeding.What does the fox say? Napoles: hindi ko po alam.,1383889983.0,HelloDonne,'398810401116127232',,,,,en,Ring-ding-ding-ding-dingeringeding! Gering-ding-ding-ding-dingeringeding.What does the fox say? Napoles: hindi ko po alam.,"[Ring, ding, ding, ding, dingeringeding, Gering, ding, ding, ding, dingeringeding, fox, Napoles, hindi, ko, po, alam]"
771,Pigfarts,Miriam Defensor and Janet Napoles oh my god (sorry watching it just now because NO TV) HAHAHSkHDKLASKd,1383889987.0,KimPeAguirre,'398810415108329472',Beijing,,28800.0,,en,Miriam Defensor and Janet Napoles oh my god (sorry watching it just now because NO TV) HAHAHSkHDKLASKd,"[Miriam, Defensor, Janet, Napoles, oh, god, sorry, watching, TV, HAHAHSkHDKLASKd]"
772,"Manila, Philippines","RT""@HecklerForever: The most annoying thing about Janet Lim-Napoles after yesterday's hearing? She was still breathing.""",1383890007.0,gretarevilla,'398810498461745152',Alaska,,-32400.0,,en,"RT""@HecklerForever: The most annoying thing about Janet Lim-Napoles after yesterday's hearing? She was still breathing.""","[RT""@HecklerForever, annoying, thing, Janet, Lim, Napoles, yesterday, 's, hearing, breathing]"
773,,#iinvokemyright_napoles,1383890054.0,BeaGabriel3,'398810696697135104',,,,,en,#iinvokemyright_napoles,[iinvokemyright_napoles]
774,Philippines,"Rappler Newscast: Yolanda PH, pork barrel, HK and Manila | Watch: http://t.co/4LJDRLA3DO via Rappler",1383890080.0,VideoTweetsPH,'398810805267087360',,,,,en,"Rappler Newscast: Yolanda PH, pork barrel, HK and Manila | Watch: http://t.co/4LJDRLA3DO via Rappler","[Rappler, Newscast, Yolanda, PH, pork, barrel, HK, Manila, |, Watch, http://t.co/4LJDRLA3DO, Rappler]"
775,Philippines,Let's just pray for #YolandaPH victims .. No Napoles case at this time #GodBlessPHILIPPINES #PrayForThePhilippines,1383890082.0,vixslappedTV,'398810816096370688',Irkutsk,,32400.0,,en,Let's just pray for #YolandaPH victims .. No Napoles case at this time #GodBlessPHILIPPINES #PrayForThePhilippines,"[Let, 's, pray, YolandaPH, victims, Napoles, case, time, GodBlessPHILIPPINES, PrayForThePhilippines]"
776,Philippines :),Meet my pet Napoles  http://t.co/EkU9sNqcx0,1383890087.0,31JOANNECLAIRE,'398810834450653185',Greenland,,-10800.0,,en,Meet my pet Napoles  http://t.co/EkU9sNqcx0,"[Meet, pet, Napoles,  , http://t.co/EkU9sNqcx0]"
777,,"Maybe in her head she oathed to tell a lie, a whole lie and nothing but a lie. :( #Napoles",1383890095.0,MhiekaBatoon,'398810869439528960',,,,,en,"Maybe in her head she oathed to tell a lie, a whole lie and nothing but a lie. :( #Napoles","[Maybe, head, oathed, tell, lie, lie, lie, Napoles]"
778,eating santa's cookies,I used to pronounce napoles as nay-poulsThen I was like what kind of name is naypoulsIt sounds like nipples,1383890131.0,_FrustDREItion,'398811019687915520',Pacific Time (US & Canada),,-28800.0,,en,I used to pronounce napoles as nay-poulsThen I was like what kind of name is naypoulsIt sounds like nipples,"[pronounce, napoles, nay, poulsThen, like, kind, naypoulsIt, sounds, like, nipples]"
779,"Alexandria, VA",Pork Barrel BBQ Offers Reward for Finding Houdini http://t.co/39UqzlwKfB,1383890184.0,WEAlexVAPatch,'398811243856683010',Atlantic Time (Canada),,-14400.0,,en,Pork Barrel BBQ Offers Reward for Finding Houdini http://t.co/39UqzlwKfB,"[Pork, Barrel, BBQ, Offers, Reward, Finding, Houdini, http://t.co/39UqzlwKfB]"
780,Location is for stalkers.;)),"@vicegandako Would you care to explain ""napoles-zoned""? :D hihi.",1383890206.0,AMagicalOwl,'398811336081018880',Singapore,,28800.0,,en,"@vicegandako Would you care to explain ""napoles-zoned""? :D hihi.","[@vicegandako, care, explain, napoles, zoned, :D, hihi]"
781,Rndvd  :(,Hi iamjunecarla. Hi Coyel-Napoles(jk) #Bestfriend #Peace #Rock #Love http://t.co/nMT6551Tia,1383890228.0,Gteenb,'398811426292514816',Alaska,,-32400.0,,en,Hi iamjunecarla. Hi Coyel-Napoles(jk) #Bestfriend #Peace #Rock #Love http://t.co/nMT6551Tia,"[Hi, iamjunecarla, Hi, Coyel, Napoles(jk, Bestfriend, Peace, Rock, Love, http://t.co/nMT6551Tia]"
782,,"@ghejoyaquino @theaadritchbomb @DaveTalens @gabcatli ""I Invoke my rights - janet napoles",1383890249.0,ManongJobert,'398811515085529090',,,,,en,"@ghejoyaquino @theaadritchbomb @DaveTalens @gabcatli ""I Invoke my rights - janet napoles","[@ghejoyaquino, @theaadritchbomb, @DaveTalens, @gabcatli, Invoke, rights, janet, napoles]"
783,Third World,"""@HecklerForever: The most annoying thing about Janet Lim-Napoles after yesterday's hearing? She was still breathing.""",1383890284.0,Mackyyys,'398811663178006529',Pacific Time (US & Canada),,-28800.0,,en,"""@HecklerForever: The most annoying thing about Janet Lim-Napoles after yesterday's hearing? She was still breathing.""","[@HecklerForever, annoying, thing, Janet, Lim, Napoles, yesterday, 's, hearing, breathing]"
784,Phil.| MNL,Yolanda go and attack Napoles now,1383890306.0,waltercostales,'398811753032605696',Beijing,,28800.0,,en,Yolanda go and attack Napoles now,"[Yolanda, attack, Napoles]"
785,3 north,"RT @Catyeneza: Mom:""How are your grades?"" Me:""I invoke my right against self-incrimination""     Napoles haha :))))",1383890308.0,DiegoImao37,'398811762734014464',Hong Kong,,28800.0,,en,"RT @Catyeneza: Mom:""How are your grades?"" Me:""I invoke my right against self-incrimination""     Napoles haha :))))","[RT, @Catyeneza, Mom:""How, grades, Me:""I, invoke, right, self, incrimination,     , Napoles, haha]"
786,En los cuernos de la luna,@luiss_sosa el fishers napoles,1383890333.0,ELPOLLODICE,'398811866635309056',,,,,en,@luiss_sosa el fishers napoles,"[@luiss_sosa, el, fishers, napoles]"
787,"Manila, Philippines",Legarda: Ive given up my pork for 2014 http://t.co/1VBSemMU9c #Napoles @maila_ager,1383890340.0,inquirerdotnet,'398811897396346880',Hong Kong,,28800.0,,en,Legarda: Ive given up my pork for 2014 http://t.co/1VBSemMU9c #Napoles @maila_ager,"[Legarda, ve, given, pork, http://t.co/1VBSemMU9c, Napoles, @maila_ager]"
788,,8 Janet Napoles Answers to Classic Miss Universe Questions via @The8List http://t.co/4EMDBdlYRQ,1383890375.0,DmbfoundedMe,'398812042770923523',Beijing,,28800.0,,en,8 Janet Napoles Answers to Classic Miss Universe Questions via @The8List http://t.co/4EMDBdlYRQ,"[Janet, Napoles, Answers, Classic, Miss, Universe, Questions, @The8List, http://t.co/4EMDBdlYRQ]"
789,,"""@BagyongYoIanda: I invoke my right against self-incrimination."" Hahaha Napoles",1383890430.0,sunraizz,'398812272526520320',Beijing,,28800.0,,en,"""@BagyongYoIanda: I invoke my right against self-incrimination."" Hahaha Napoles","[@BagyongYoIanda, invoke, right, self, incrimination, Hahaha, Napoles]"
790,"Manila, Philippines","Dear Yolly, If we offer Napoles as human sacrifice, will you leave the country sooner? You'll like her-she's worth P10B! Love, Me #YolandaPH",1383890434.0,shortofsaying,'398812292524949504',Taipei,,28800.0,,en,"Dear Yolly, If we offer Napoles as human sacrifice, will you leave the country sooner? You'll like her-she's worth P10B! Love, Me #YolandaPH","[Dear, Yolly, offer, Napoles, human, sacrifice, leave, country, sooner, 'll, like, 's, worth, P10B, Love, YolandaPH]"
791,,HAHAHA!now ko lang nakita :DArnold Clavio's interview with Atty. Alfredo Villamor (Janet Napoles' La...: http://t.co/LA1TPFELZA via @youtube,1383890472.0,marivicnavaja,'398812451736518656',International Date Line West,,-39600.0,,en,HAHAHA!now ko lang nakita :DArnold Clavio's interview with Atty. Alfredo Villamor (Janet Napoles' La...: http://t.co/LA1TPFELZA via @youtube,"[HAHAHA!now, ko, lang, nakita, DArnold, Clavio, 's, interview, Atty, Alfredo, Villamor, Janet, Napoles, La, http://t.co/LA1TPFELZA, @youtube]"
792,,What does the fox say? Napoles: Di ko po alam. -Ay put....,1383890543.0,itsmeallenpie,'398812748500307968',Lisbon,,0.0,,en,What does the fox say? Napoles: Di ko po alam. -Ay put....,"[fox, Napoles, Di, ko, po, alam, -Ay]"
793,,@vicegandako @garvothe13 #napoles is that you?... haha..,1383890564.0,sheymhae,'398812836509392896',,,,,en,@vicegandako @garvothe13 #napoles is that you?... haha..,"[@vicegandako, @garvothe13, napoles, haha]"
794,,Watching the senate hearing of Napoles &amp; idk why. I'm waiting for Miriam,1383890586.0,MarciaVega_,'398812930461806592',Beijing,,28800.0,,en,Watching the senate hearing of Napoles &amp; idk why. I'm waiting for Miriam,"[Watching, senate, hearing, Napoles, amp, idk, 'm, waiting, Miriam]"
795,SomewhereAwesomePeopleHangOut,@asdfghJeeews New version of Napoles!,1383890600.0,Kaaashley,'398812986090852353',Hawaii,,-36000.0,,en,@asdfghJeeews New version of Napoles!,"[@asdfghJeeews, New, version, Napoles]"
796,,"""@jmsarno22: #QuoteOfTheDay NAPOLES: Hindi ko po alam http://t.co/7ZCTKmdnS2""",1383890612.0,MLNBiancss,'398813037798232064',Arizona,,-25200.0,,en,"""@jmsarno22: #QuoteOfTheDay NAPOLES: Hindi ko po alam http://t.co/7ZCTKmdnS2""","[@jmsarno22, QuoteOfTheDay, NAPOLES, Hindi, ko, po, alam, http://t.co/7ZCTKmdnS2]"
797,"Metro Manila, Philippines",Strongest typhoon: YolandaStrongest Nation: PhilippinesStrongest People: FilipinosStrongest Face: Napoles#repost #YolandaPH #justkidding,1383890630.0,tijayski,'398813112834342912',Taipei,,28800.0,,en,Strongest typhoon: YolandaStrongest Nation: PhilippinesStrongest People: FilipinosStrongest Face: Napoles#repost #YolandaPH #justkidding,"[Strongest, typhoon, YolandaStrongest, Nation, PhilippinesStrongest, People, FilipinosStrongest, Face, Napoles#repost, YolandaPH, justkidding]"
798,"Naga City, Philippines",LOL@Wikipedia's article about Self-Incrimination. Under Philippine Law: see also: Janet Lim-Napoles,1383890849.0,Oteppanyaki,'398814031969939456',Singapore,,28800.0,,en,LOL@Wikipedia's article about Self-Incrimination. Under Philippine Law: see also: Janet Lim-Napoles,"[LOL@Wikipedia, 's, article, Self, Incrimination, Philippine, Law, Janet, Lim, Napoles]"
799,Philippines,@manila_bulletin: Escudero wants Napoles in ordinary jailhttp://t.co/MXmU0YgzKw http://t.co/Lf4aAXFvwE,1383890852.0,janiellepearl,'398814043881738240',Hong Kong,,28800.0,,en,@manila_bulletin: Escudero wants Napoles in ordinary jailhttp://t.co/MXmU0YgzKw http://t.co/Lf4aAXFvwE,"[@manila_bulletin, Escudero, wants, Napoles, ordinary, jailhttp://t.co, MXmU0YgzKw, http://t.co/Lf4aAXFvwE]"
800,,@godknowshudas @http://newsinfo.inquirer.net/523189/escudero-wants-napoles-transfer-to-regular-jail i agree with Sen Escudero ,1383890916.0,EdmanPole,'398814313592274944',Abu Dhabi,,14400.0,,en,@godknowshudas @http://newsinfo.inquirer.net/523189/escudero-wants-napoles-transfer-to-regular-jail i agree with Sen Escudero ,"[@godknowshudas, @http://newsinfo.inquirer.net/523189/escudero, wants, napoles, transfer, regular, jail, agree, Sen, Escudero]"
801,Philippines,"""@kimannortiz: I invoke my right against self-incrimination."" NA NAPOLES XDD",1383890922.0,dayanlabss,'398814336568672256',Beijing,,28800.0,,en,"""@kimannortiz: I invoke my right against self-incrimination."" NA NAPOLES XDD","[@kimannortiz, invoke, right, self, incrimination, NA, NAPOLES, XDD]"
802,MNL. Phlippines,"Mrs. Napoles, please tell the truth. Please? http://t.co/i5aoTb3etm",1383890940.0,Jac_Reacher,'398814413353791488',Pacific Time (US & Canada),,-28800.0,,en,"Mrs. Napoles, please tell the truth. Please? http://t.co/i5aoTb3etm","[Mrs., Napoles, tell, truth, http://t.co/i5aoTb3etm]"
803,Australia,That napoles and chicser tweet &gt;&gt;&gt;  ya make me happy @BagyongYolanda,1383890954.0,whitecrayolaa,'398814471314890752',Sydney,,39600.0,,en,That napoles and chicser tweet &gt;&gt;&gt;  ya make me happy @BagyongYolanda,"[napoles, chicser, tweet, gt;&gt;&gt,  , ya, happy, @BagyongYolanda]"
804,Bradford,"""@JogeLLY: ""@BagyongYoIanda: I invoke my right against self-incrimination."" #Napoles. Hahahahahaha""",1383891012.0,ALLEYLOVESS,'398814714458673152',Singapore,,28800.0,,en,"""@JogeLLY: ""@BagyongYoIanda: I invoke my right against self-incrimination."" #Napoles. Hahahahahaha""","[@JogeLLY, @BagyongYoIanda, invoke, right, self, incrimination, Napoles, Hahahahahaha]"
805,"Naga City, Philippines",@nikioquendo napoles' too sassy for ya,1383891026.0,elmadelatorre,'398814774483378176',Pacific Time (US & Canada),,-28800.0,,en,@nikioquendo napoles' too sassy for ya,"[@nikioquendo, napoles, sassy, ya]"
806,Bulakan,GNight! madlang People .. God is in control #Napoles,1383891030.0,aewin_26,'398814790283296768',Beijing,,28800.0,,en,GNight! madlang People .. God is in control #Napoles,"[GNight, madlang, People, God, control, Napoles]"
