,user utc offset,text,created_at,user,id,user time zone,lng,user location,lat,language,Parsed,lemmas
0, Bayan Kong PILIPINAS,No. I revoke my right to self incrimination  No ka dyan. Haha. #Napoles-zoned http://t.co/LAmxC6JTW9,1383874538.0,MahalKongIsko,'398745618753261568',Beijing,,28800.0,,en,No. I revoke my right to self incrimination  No ka dyan. Haha. #Napoles-zoned http://t.co/LAmxC6JTW9,"[revoke, right, self, incrimination,  , ka, dyan, Haha, Napoles, zoned, http://t.co/LAmxC6JTW9]"
1,Quezon City,Yolanda is Janet Napoles' sister! #PrayforthePhilippines,1383874587.0,CKALatiza,'398745825930510336',Pacific Time (US & Canada),,-28800.0,,en,Yolanda is Janet Napoles' sister! #PrayforthePhilippines,"[Yolanda, Janet, Napoles, sister, PrayforthePhilippines]"
2,"ManiLa ,Phillipines ","Porkbarrel Scam , Earthquake , #YolandaPH #PrayForThePhilippines PRAYER is Always Waterproof ;-)",1383874603.0,JaylloidLabsyoo,'398745889876885504',Beijing,,28800.0,,en,"Porkbarrel Scam , Earthquake , #YolandaPH #PrayForThePhilippines PRAYER is Always Waterproof ;-)","[Porkbarrel, Scam, Earthquake, YolandaPH, PrayForThePhilippines, PRAYER, Waterproof]"
3,Cebu,""" Lets transfer Napoles to a regular jail already.  It's clear she will not cooperate to get this case moving anyway.""",1383874620.0,normanlizza,'398745962077622273',,,,,en,""" Lets transfer Napoles to a regular jail already.  It's clear she will not cooperate to get this case moving anyway.""","[Lets, transfer, Napoles, regular, jail,  , 's, clear, cooperate, case, moving]"
4,Somewhere Cheeky,@nicolePROPHETa yes pork barrel na yan HAHA I was gonna say that actually HAHA,1383874697.0,justlaughloud,'398746283642343425',Alaska,,-32400.0,,en,@nicolePROPHETa yes pork barrel na yan HAHA I was gonna say that actually HAHA,"[@nicolePROPHETa, yes, pork, barrel, na, yan, HAHA, gon, na, actually, HAHA]"
5,New York  Batangas,"""I INVOKE MY RIGHTS"" favorite lines ni Napoles. Hahaha",1383874731.0,OfficialJaypeeM,'398746426651320320',Abu Dhabi,,14400.0,,en,"""I INVOKE MY RIGHTS"" favorite lines ni Napoles. Hahaha","[INVOKE, RIGHTS, favorite, lines, ni, Napoles, Hahaha]"
6,Philippines,Hiring Admin  I Invoke My Right Against Self Incrimination - Janet NapolesSino gusto?,1383874732.0,iamjufren10,'398746434377637888',Pacific Time (US & Canada),,-28800.0,,en,Hiring Admin  I Invoke My Right Against Self Incrimination - Janet NapolesSino gusto?,"[Hiring, Admin,  , Invoke, Right, Self, Incrimination, Janet, NapolesSino, gusto]"
7,"manila, phillipines","@medaKeepCalm: I say ""I DON'T KNOW"" to everything when I'm in a bad mood. Bad mood si Napoles",1383874744.0,youknees_19,'398746481143738368',Alaska,,-32400.0,,en,"@medaKeepCalm: I say ""I DON'T KNOW"" to everything when I'm in a bad mood. Bad mood si Napoles","[@medaKeepCalm, DON'T, KNOW, 'm, bad, mood, Bad, mood, si, Napoles]"
8,"Manila, Philippines",Bong's lawyer: Senate body violated Napoles' right @PhilstarNews http://t.co/TEaLmTI25c,1383874763.0,PhilstarNews,'398746562060251136',Singapore,,28800.0,,en,Bong's lawyer: Senate body violated Napoles' right @PhilstarNews http://t.co/TEaLmTI25c,"[Bong, 's, lawyer, Senate, body, violated, Napoles, right, @PhilstarNews, http://t.co/TEaLmTI25c]"
9,Philippines,Palace does not intend to feed alleged pork barrel queen Janet Lim-Napoles to the lions despite her refusal to talk,1383874770.0,aureacalica,'398746591344877568',Singapore,,28800.0,,en,Palace does not intend to feed alleged pork barrel queen Janet Lim-Napoles to the lions despite her refusal to talk,"[Palace, intend, feed, alleged, pork, barrel, queen, Janet, Lim, Napoles, lions, despite, refusal, talk]"
10,"Quezon City, Philippines",RT @aureacalica: Palace does not intend to feed alleged pork barrel queen Janet Lim-Napoles to the lions despite her refusal to talk,1383874843.0,scribblerjack,'398746898669895680',Ulaan Bataar,,28800.0,,en,RT @aureacalica: Palace does not intend to feed alleged pork barrel queen Janet Lim-Napoles to the lions despite her refusal to talk,"[RT, @aureacalica, Palace, intend, feed, alleged, pork, barrel, queen, Janet, Lim, Napoles, lions, despite, refusal, talk]"
11,"Quezon City, Philippines","@PhilstarNews # More than deletion, we'd to see they make laws making it a crime for legislators to have it! NO MORE PORK BARREL in Congress",1383874875.0,Baibonn,'398747031147003905',,,,,en,"@PhilstarNews # More than deletion, we'd to see they make laws making it a crime for legislators to have it! NO MORE PORK BARREL in Congress","[@PhilstarNews, deletion, 'd, laws, making, crime, legislators, PORK, BARREL, Congress]"
12,"Tanza Cavite, PHI","Pork Barrel Scam, earthquake, super typhoon... #PrayForThePhilippines",1383874879.0,_ohItsSuuuperA,'398747050713444352',Hong Kong,,28800.0,,en,"Pork Barrel Scam, earthquake, super typhoon... #PrayForThePhilippines","[Pork, Barrel, Scam, earthquake, super, typhoon, PrayForThePhilippines]"
13,,Wow. Kumare. @PhilstarNews: Bong's lawyer: Senate body violated Napoles' right @PhilstarNews http://t.co/NYNC98EQAB,1383874882.0,beRODJ,'398747063141167104',Kuala Lumpur,,28800.0,,en,Wow. Kumare. @PhilstarNews: Bong's lawyer: Senate body violated Napoles' right @PhilstarNews http://t.co/NYNC98EQAB,"[Wow, Kumare, @PhilstarNews, Bong, 's, lawyer, Senate, body, violated, Napoles, right, @PhilstarNews, http://t.co/NYNC98EQAB]"
14,,@kidyeol me too. I prefer wiggleroom. Sigh na-napoles friend natin &gt;&lt; napoles 2.0,1383874900.0,yixinq_b,'398747136520515584',Hong Kong,,28800.0,,en,@kidyeol me too. I prefer wiggleroom. Sigh na-napoles friend natin &gt;&lt; napoles 2.0,"[@kidyeol, prefer, wiggleroom, Sigh, na, napoles, friend, natin, gt;&lt, napoles]"
15,Philippines,NAPOLES-ZONEhi hi hello -sliggity http://t.co/jq2VIfgHdm,1383874904.0,JBTAGALOGMEMES,'398747152178225152',Arizona,,-25200.0,,en,NAPOLES-ZONEhi hi hello -sliggity http://t.co/jq2VIfgHdm,"[NAPOLES, ZONEhi, hi, hello, -sliggity, http://t.co/jq2VIfgHdm]"
16,Philippines,Palace does not intend to feed alleged pork barrel queen Janet Lim-Napoles to the lions despite her refusal to talk | via @aureacalica,1383874926.0,PhilippineStar,'398747245858021376',Hong Kong,,28800.0,,en,Palace does not intend to feed alleged pork barrel queen Janet Lim-Napoles to the lions despite her refusal to talk | via @aureacalica,"[Palace, intend, feed, alleged, pork, barrel, queen, Janet, Lim, Napoles, lions, despite, refusal, talk, |, @aureacalica]"
17,Jamie's Pocket,@lermanchance @readeatfangirl @oncemoredorothy I'm kind of glad that they somehow diverted some of the attentionto Napoles not just thestorm,1383874934.0,adriaaannee,'398747279265251328',Singapore,,28800.0,,en,@lermanchance @readeatfangirl @oncemoredorothy I'm kind of glad that they somehow diverted some of the attentionto Napoles not just thestorm,"[@lermanchance, @readeatfangirl, @oncemoredorothy, 'm, kind, glad, diverted, attentionto, Napoles, thestorm]"
18,Philippines,The safety of detainees is an institutional concern of the government - Coloma on securing Napoles even without her spilling the beans,1383874962.0,aureacalica,'398747398165393408',Singapore,,28800.0,,en,The safety of detainees is an institutional concern of the government - Coloma on securing Napoles even without her spilling the beans,"[safety, detainees, institutional, concern, government, Coloma, securing, Napoles, spilling, beans]"
19,instagram: aidelacruz,@gmanews: Napoles' denials can be used against her Escudero http://t.co/NNYsqBMlJx Yesss! I love Chiz! :D,1383874977.0,aidelacruz,'398747460903768064',Hong Kong,,28800.0,,en,@gmanews: Napoles' denials can be used against her Escudero http://t.co/NNYsqBMlJx Yesss! I love Chiz! :D,"[@gmanews, Napoles, denials, Escudero, http://t.co/NNYsqBMlJx, Yesss, love, Chiz, :D]"
20,Philippines,#APMBREAKING: Escudero: Put Napoles in ordinary jail http://t.co/jVB2FmPQ1U,1383874995.0,CHNnews360,'398747534044450816',Hong Kong,,28800.0,,en,#APMBREAKING: Escudero: Put Napoles in ordinary jail http://t.co/jVB2FmPQ1U,"[APMBREAKING, Escudero, Napoles, ordinary, jail, http://t.co/jVB2FmPQ1U]"
21,follow back only 4 200% Sones,"lucky I found the whole drama REPLAY: Livestream: Napoles at Senate pork scam hearing (Nov. 7, 2013) http://t.co/5bWuyyJ4x7 via @gmanews",1383875023.0,jigeumeun,'398747654223454208',Taipei,,28800.0,,en,"lucky I found the whole drama REPLAY: Livestream: Napoles at Senate pork scam hearing (Nov. 7, 2013) http://t.co/5bWuyyJ4x7 via @gmanews","[lucky, found, drama, REPLAY, Livestream, Napoles, Senate, pork, scam, hearing, Nov., http://t.co/5bWuyyJ4x7, @gmanews]"
22,,napoles though..,1383875099.0,zeeahhco,'398747972566929408',Alaska,,-32400.0,,en,napoles though..,[napoles]
23,,#PrayForThePhilippines that this typhoon Yolanda may wipe away Janet Lim Napoles from the face of the earth!,1383875120.0,AlexaArmendi,'398748058885689344',Beijing,,28800.0,,en,#PrayForThePhilippines that this typhoon Yolanda may wipe away Janet Lim Napoles from the face of the earth!,"[PrayForThePhilippines, typhoon, Yolanda, wipe, away, Janet, Lim, Napoles, face, earth]"
24,,Bong&amp;#039;s lawyer: Senate body violated Napoles&amp;#039; right @PhilstarNews http://t.co/EBOweE3MlN via @sharethis,1383875126.0,jedqcepe,'398748083732746241',,,,,en,Bong&amp;#039;s lawyer: Senate body violated Napoles&amp;#039; right @PhilstarNews http://t.co/EBOweE3MlN via @sharethis,"[Bong&amp;#039;s, lawyer, Senate, body, violated, Napoles&amp;#039, right, @PhilstarNews, http://t.co/EBOweE3MlN, @sharethis]"
25,Makati City,NAPOLES REMAINS MUM ON SCAM AFTER HEARING | #GNN,1383875134.0,GNN_TV,'398748116817432576',,,,,en,NAPOLES REMAINS MUM ON SCAM AFTER HEARING | #GNN,"[NAPOLES, REMAINS, MUM, SCAM, HEARING, |, GNN]"
26,MNL,@frvrjen HND KO PO ALM -NAPOLES,1383875190.0,pankiedavid,'398748351455186944',,,,,en,@frvrjen HND KO PO ALM -NAPOLES,"[@frvrjen, HND, KO, PO, ALM, -NAPOLES]"
27,Philippines,My Amnesia Girl starring Janet Napoles #medyobadgirl,1383875201.0,AiraaIlagan,'398748400943775744',Beijing,,28800.0,,en,My Amnesia Girl starring Janet Napoles #medyobadgirl,"[Amnesia, Girl, starring, Janet, Napoles, medyobadgirl]"
28,,"Pardon my French but, fuck you, Janet. RT ""@maria_ressa: Napoles: I'm not wealthy, 'just right' via @rapplerdotcom http://t.co/XbBLvbOYJL""",1383875232.0,maisaysso,'398748531579572224',Beijing,,28800.0,,en,"Pardon my French but, fuck you, Janet. RT ""@maria_ressa: Napoles: I'm not wealthy, 'just right' via @rapplerdotcom http://t.co/XbBLvbOYJL""","[Pardon, French, fuck, Janet, RT, @maria_ressa, Napoles, 'm, wealthy, right, @rapplerdotcom, http://t.co/XbBLvbOYJL]"
29,,"""Mahal mo ba ako?""  ""I invoke my right to self incrimination""   #NapolesZoned #Napoles #repost",1383875261.0,PreciousJeeey,'398748651993853952',,,,,en,"""Mahal mo ba ako?""  ""I invoke my right to self incrimination""   #NapolesZoned #Napoles #repost","[Mahal, mo, ba, ako,  , invoke, right, self, incrimination,   , NapolesZoned, Napoles, repost]"
30,WORLDWIDE,"Yolanda when you go, please take napoles with you :)) #G2BRiskItAll",1383875263.0,KathNielDancers,'398748658122096640',London,,0.0,,en,"Yolanda when you go, please take napoles with you :)) #G2BRiskItAll","[Yolanda, napoles, G2BRiskItAll]"
31,Philippines,Watch this freestyle take on the #PorkProbe and #Napoles http://t.co/AybBjSKnu5 #BalikBayan http://t.co/k3DAdPDjKD,1383875291.0,rapplerdotcom,'398748777931997184',Taipei,,28800.0,,en,Watch this freestyle take on the #PorkProbe and #Napoles http://t.co/AybBjSKnu5 #BalikBayan http://t.co/k3DAdPDjKD,"[Watch, freestyle, PorkProbe, Napoles, http://t.co/AybBjSKnu5, BalikBayan, http://t.co/k3DAdPDjKD]"
32,philippines,THE WEB MAGAZINE: Viral Fake Interview: The Napoles Daughter's React... http://t.co/8bNBejIJEN,1383875293.0,simplymarrimye,'398748785037172738',Pacific Time (US & Canada),,-28800.0,,en,THE WEB MAGAZINE: Viral Fake Interview: The Napoles Daughter's React... http://t.co/8bNBejIJEN,"[WEB, MAGAZINE, Viral, Fake, Interview, Napoles, Daughter, 's, React, http://t.co/8bNBejIJEN]"
33,Bacolod/Manila,"We dare Escudero challenge her denials! ""@gmanews: Napoles' denials can be used against her Escudero http://t.co/fVcN0DPAj8",1383875294.0,primpaypon,'398748790855057408',Hong Kong,,28800.0,,en,"We dare Escudero challenge her denials! ""@gmanews: Napoles' denials can be used against her Escudero http://t.co/fVcN0DPAj8","[dare, Escudero, challenge, denials, @gmanews, Napoles, denials, Escudero, http://t.co/fVcN0DPAj8]"
34,New York  Batangas,What does the pig say? NAPOLES: sinungalinglinglinglingling#rp #Napoles,1383875376.0,OfficialJaypeeM,'398749131696373760',Abu Dhabi,,14400.0,,en,What does the pig say? NAPOLES: sinungalinglinglinglingling#rp #Napoles,"[pig, NAPOLES, sinungalinglinglinglingling#rp, Napoles]"
35,mnl - zmga,You look like Napoles @Chrstinealforte hahahahahaha love you! http://t.co/V1E3UK128R,1383875394.0,hakunamachata,'398749210784169984',Pacific Time (US & Canada),,-28800.0,,en,You look like Napoles @Chrstinealforte hahahahahaha love you! http://t.co/V1E3UK128R,"[look, like, Napoles, @Chrstinealforte, hahahahahaha, love, http://t.co/V1E3UK128R]"
36,IG: yobadgalmimi,"""MY AMNESIA GIRL 2.0"" #Napoles baboy #Porkbarrel pky :p  http://t.co/KxryKIPnRv",1383875424.0,YoBadgalmimi,'398749334545526785',Atlantic Time (Canada),,-14400.0,,en,"""MY AMNESIA GIRL 2.0"" #Napoles baboy #Porkbarrel pky :p  http://t.co/KxryKIPnRv","[AMNESIA, GIRL, Napoles, baboy, Porkbarrel, pky, :p,  , http://t.co/KxryKIPnRv]"
37,"Gen.Trias, Cavite",watching the Senate Hearing on pork barrel scam that aired yesterday. I wanted to see for myself everything that happened.,1383875437.0,jAnneAyuyao,'398749388824006656',Alaska,,-32400.0,,en,watching the Senate Hearing on pork barrel scam that aired yesterday. I wanted to see for myself everything that happened.,"[watching, Senate, Hearing, pork, barrel, scam, aired, yesterday, wanted, happened]"
38,"LAGUNA, PH","YOLANDA, Y U NOT JUST GO TO JANET NAPOLES' HOUSE THEN LEAVE PLS",1383875450.0,princeianjervis,'398749441995177984',Quito,,-18000.0,,en,"YOLANDA, Y U NOT JUST GO TO JANET NAPOLES' HOUSE THEN LEAVE PLS","[YOLANDA, Y, U, JANET, NAPOLES, HOUSE, LEAVE, PLS]"
39,Another World,Janet Lim-Napoles is still the strongest Typhoon in the history. #PrayForThePhilippines,1383875480.0,mabbyitsyouu,'398749569028079616',Kuala Lumpur,,28800.0,,en,Janet Lim-Napoles is still the strongest Typhoon in the history. #PrayForThePhilippines,"[Janet, Lim, Napoles, strongest, Typhoon, history, PrayForThePhilippines]"
40,,"Yolanda, leave us alone... take Janet Napoles with you too... #PrayForThePhilippines",1383875513.0,IAmSignum,'398749709226881024',Alaska,,-32400.0,,en,"Yolanda, leave us alone... take Janet Napoles with you too... #PrayForThePhilippines","[Yolanda, leave, Janet, Napoles, PrayForThePhilippines]"
41,111 Howard Drive ,Torn between the Napoles news and the typhoon for balitaan on Monday ,1383875542.0,kynanotkina,'398749828751974400',Pacific Time (US & Canada),,-28800.0,,en,Torn between the Napoles news and the typhoon for balitaan on Monday ,"[Torn, Napoles, news, typhoon, balitaan, Monday]"
42,JAPAN  LAGUNA,What does the pig say?NAPOLES: sinungalinglinglinglingling,1383875553.0,RAINfinity8,'398749877271674880',Tokyo,,32400.0,,en,What does the pig say?NAPOLES: sinungalinglinglinglingling,"[pig, say?NAPOLES, sinungalinglinglinglingling]"
43,Nowhere,#ARTPOPxASTROPLUS @Astroplus1  @mca_music  let's forget about napoles for a while and give attention to this @skeithler  @hausofjerald,1383875566.0,CedieGaga,'398749930174427137',Beijing,,28800.0,,en,#ARTPOPxASTROPLUS @Astroplus1  @mca_music  let's forget about napoles for a while and give attention to this @skeithler  @hausofjerald,"[ARTPOPxASTROPLUS, @Astroplus1,  , @mca_music,  , let, 's, forget, napoles, attention, @skeithler,  , @hausofjerald]"
44,MNL,"@kynanotkina napolesit's funny cause of her answers ""di ko po alam"" HAHA",1383875574.0,Harrypotterpie,'398749966031536128',Pacific Time (US & Canada),,-28800.0,,en,"@kynanotkina napolesit's funny cause of her answers ""di ko po alam"" HAHA","[@kynanotkina, napolesit, 's, funny, cause, answers, di, ko, po, alam, HAHA]"
45,,Will Napoles tell the truth in the Senate inquiry on pork barrel scam today? I doubt. @inquirerdotnet,1383875584.0,OscarLimin,'398750005667700736',Beijing,,28800.0,,en,Will Napoles tell the truth in the Senate inquiry on pork barrel scam today? I doubt. @inquirerdotnet,"[Napoles, tell, truth, Senate, inquiry, pork, barrel, scam, today, doubt, @inquirerdotnet]"
46,,Imprisoning Napoles won't be enough. Don't forget that the money came from public funds controlled by govt officials. We're losing focus.,1383875588.0,IFoldMyShorts,'398750023854206976',Alaska,,-32400.0,,en,Imprisoning Napoles won't be enough. Don't forget that the money came from public funds controlled by govt officials. We're losing focus.,"[Imprisoning, Napoles, wo, n't, n't, forget, money, came, public, funds, controlled, govt, officials, 're, losing, focus]"
47,"Isabela, Philippines",NAPOLES + YOLANDA :-( #PrayForThePhilippines,1383875618.0,laniefegaliza,'398750147569414144',,,,,en,NAPOLES + YOLANDA :-( #PrayForThePhilippines,"[NAPOLES, +, YOLANDA, PrayForThePhilippines]"
48,"Quezon, Philippines",What's on your mind?I Invoke My Right Against Self Incrimination - Janet Napoles,1383875625.0,MichaelAlegre,'398750177122844672',Taipei,,28800.0,,en,What's on your mind?I Invoke My Right Against Self Incrimination - Janet Napoles,"['s, mind?I, Invoke, Right, Self, Incrimination, Janet, Napoles]"
49,Philippines,"Janet Lim Napoles denied she is wealthy, but rather ""tama lang sa buhay (comfortable in life) http://t.co/bQQrrIdxWQ #PorkProbe",1383875625.0,rapplerdotcom,'398750178816950272',Taipei,,28800.0,,en,"Janet Lim Napoles denied she is wealthy, but rather ""tama lang sa buhay (comfortable in life) http://t.co/bQQrrIdxWQ #PorkProbe","[Janet, Lim, Napoles, denied, wealthy, tama, lang, sa, buhay, comfortable, life, http://t.co/bQQrrIdxWQ, PorkProbe]"
50,,"@dlfredeluces JUST WAIT. ""thor will be back"" HAHAHAHAHA For now, ROBOCOP muna kc may napoles pa =))))) ""i invoke my right.."" #TrueLokiHere",1383875662.0,GurtizaJustine,'398750332286537728',,,,,en,"@dlfredeluces JUST WAIT. ""thor will be back"" HAHAHAHAHA For now, ROBOCOP muna kc may napoles pa =))))) ""i invoke my right.."" #TrueLokiHere","[@dlfredeluces, WAIT, thor, HAHAHAHAHA, ROBOCOP, muna, kc, napoles, pa, =, invoke, right, TrueLokiHere]"
51,,I'd hate it if the Napoles scam simply becomes yet another squabble that will remain open-ended due to fears of uncovering dangerous truths.,1383875693.0,IFoldMyShorts,'398750461584363520',Alaska,,-32400.0,,en,I'd hate it if the Napoles scam simply becomes yet another squabble that will remain open-ended due to fears of uncovering dangerous truths.,"['d, hate, Napoles, scam, simply, squabble, remain, open, ended, fears, uncovering, dangerous, truths]"
52,CA,"Napoles be like idk, i cant remember",1383875704.0,notchloie,'398750510699651072',Arizona,,-25200.0,,en,"Napoles be like idk, i cant remember","[Napoles, like, idk, nt, remember]"
53,,"As expected, Napoles would invoke her right against self incrimination. Asahan na yan. @PhilippineStar",1383875715.0,AIlaban,'398750553976471552',,,,,en,"As expected, Napoles would invoke her right against self incrimination. Asahan na yan. @PhilippineStar","[expected, Napoles, invoke, right, self, incrimination, Asahan, na, yan, @PhilippineStar]"
54,@IBGDRGN'S,"""@wattpaddicts: Pork Barrel Scam. Earthquake. Super Typhoon. #PrayForThePhilippines""",1383875716.0,sheisangelaraya,'398750559735271424',Alaska,,-32400.0,,en,"""@wattpaddicts: Pork Barrel Scam. Earthquake. Super Typhoon. #PrayForThePhilippines""","[@wattpaddicts, Pork, Barrel, Scam, Earthquake, Super, Typhoon, PrayForThePhilippines]"
55,,"Napoles would just say to Senate blue ribbon, ""I have no lawyers and I want to invoke my right against self-incirimination"". Tapos! @dzbb",1383875760.0,RomeoDaep,'398750743521292288',,,,,en,"Napoles would just say to Senate blue ribbon, ""I have no lawyers and I want to invoke my right against self-incirimination"". Tapos! @dzbb","[Napoles, Senate, blue, ribbon, lawyers, want, invoke, right, self, incirimination, Tapos, @dzbb]"
56,Narnia,#Napoles you cray,1383875777.0,choshmorever01,'398750814895763456',Wellington,,46800.0,,en,#Napoles you cray,"[Napoles, cray]"
57,MLA,If Death Note exist (Napoles Hearing) #HindiKoPoAlam #FilipinoFriday #BVphilippines #TeamPOV https://t.co/36DtGjxAVo,1383875786.0,jammieson,'398750855270526976',Hong Kong,,28800.0,,en,If Death Note exist (Napoles Hearing) #HindiKoPoAlam #FilipinoFriday #BVphilippines #TeamPOV https://t.co/36DtGjxAVo,"[Death, Note, exist, Napoles, Hearing, HindiKoPoAlam, FilipinoFriday, BVphilippines, TeamPOV, https://t.co/36DtGjxAVo]"
58,Paraaque,"If Janet Lim-Napoles is ""tama lang sa buhay"", does that make the middle-class, like me, poor as rats?",1383875821.0,brnlncgllr,'398750999835201536',Singapore,,28800.0,,en,"If Janet Lim-Napoles is ""tama lang sa buhay"", does that make the middle-class, like me, poor as rats?","[Janet, Lim, Napoles, tama, lang, sa, buhay, middle, class, like, poor, rats]"
59,,The foredoom in regard to pork barrel jobs: gsgPsPfhP,1383875965.0,JosephRachel2,'398751605077471232',,,,,en,The foredoom in regard to pork barrel jobs: gsgPsPfhP,"[foredoom, regard, pork, barrel, jobs, gsgPsPfhP]"
60,sbca,Napoles should watch Honesto haha,1383875999.0,allenpaulmartin,'398751747394383872',,,,,en,Napoles should watch Honesto haha,"[Napoles, watch, Honesto, haha]"
61,London,"""All I know is pouring rain and everything has changed."" - @taylorswift13 (Yan lang din daw ang alam ni #Napoles) #YolandaPH",1383876009.0,SenyoraTINTIN,'398751787278016513',London,,0.0,,en,"""All I know is pouring rain and everything has changed."" - @taylorswift13 (Yan lang din daw ang alam ni #Napoles) #YolandaPH","[know, pouring, rain, changed, @taylorswift13, Yan, lang, din, daw, ang, alam, ni, Napoles, YolandaPH]"
62,"Bicol, Philippines ",What does the fox says?Napoles: HINDI KO PO ALAM,1383876010.0,crisbasmayor,'398751791329726464',Beijing,,28800.0,,en,What does the fox says?Napoles: HINDI KO PO ALAM,"[fox, says?Napoles, HINDI, KO, PO, ALAM]"
63,"Malibay, Pasay City","I rather watch Oggy and the Cockroaches than the Senate hearing or whatsoever stuff about PDAF, Napoles,... http://t.co/9qJbWUYSsz",1383876020.0,iamthebonakid,'398751835928133632',Pacific Time (US & Canada),,-28800.0,,en,"I rather watch Oggy and the Cockroaches than the Senate hearing or whatsoever stuff about PDAF, Napoles,... http://t.co/9qJbWUYSsz","[watch, Oggy, Cockroaches, Senate, hearing, whatsoever, stuff, PDAF, Napoles, http://t.co/9qJbWUYSsz]"
64,taguig,They really need to give truth serum to janet napoles to make things easier. right initiates?,1383876071.0,Budisooon,'398752048088236032',Alaska,,-32400.0,,en,They really need to give truth serum to janet napoles to make things easier. right initiates?,"[need, truth, serum, janet, napoles, things, easier, right, initiates]"
65,Makati,"Bong's lawyer: Senate body violated Napoles' right: By Christina MendezMANILA, Philippines - The camp of Sen.... http://t.co/XAWiwmVEpv",1383876079.0,em_jhae,'398752082364096512',Pacific Time (US & Canada),,-28800.0,,en,"Bong's lawyer: Senate body violated Napoles' right: By Christina MendezMANILA, Philippines - The camp of Sen.... http://t.co/XAWiwmVEpv","[Bong, 's, lawyer, Senate, body, violated, Napoles, right, Christina, MendezMANILA, Philippines, camp, Sen, http://t.co/XAWiwmVEpv]"
66,,"if you are given a chance to slap a celebrity, who wo...  If only I could consider Janet Napoles as a celebrity... http://t.co/t3cf3z6dJN",1383876094.0,miyatchah501,'398752143643250688',Seoul,,32400.0,,en,"if you are given a chance to slap a celebrity, who wo...  If only I could consider Janet Napoles as a celebrity... http://t.co/t3cf3z6dJN","[given, chance, slap, celebrity, wo,  , consider, Janet, Napoles, celebrity, http://t.co/t3cf3z6dJN]"
67,"Manila, Philippines",#nowwatching Napoles Hearing http://t.co/O969cqFpWi,1383876095.0,teddeRZ10,'398752151331028992',Hong Kong,,28800.0,,en,#nowwatching Napoles Hearing http://t.co/O969cqFpWi,"[nowwatching, Napoles, Hearing, http://t.co/O969cqFpWi]"
68,@meeeaaann's,waching this janet napoles hearing at the senate,1383876116.0,angelicaverrrr,'398752238476087296',Alaska,,-32400.0,,en,waching this janet napoles hearing at the senate,"[waching, janet, napoles, hearing, senate]"
69, London ,Urgh. STFU Napoles,1383876199.0,HeyowitsHannah,'398752583541477376',London,,0.0,,en,Urgh. STFU Napoles,"[Urgh, STFU, Napoles]"
70,,#Napoles is an issue that must not be forgotten for a day as some would like is to. Its unfair that politicians enjoy life out our taxes.,1383876215.0,Edmund_0184,'398752651480805376',,,,,en,#Napoles is an issue that must not be forgotten for a day as some would like is to. Its unfair that politicians enjoy life out our taxes.,"[Napoles, issue, forgotten, day, like, unfair, politicians, enjoy, life, taxes]"
71,"Manila, Philippines","Srsly. Yolanda, please get out of PAR and take Napoles with you. Thank you.",1383876220.0,yvonnedosel,'398752671890284544',Alaska,,-32400.0,,en,"Srsly. Yolanda, please get out of PAR and take Napoles with you. Thank you.","[Srsly, Yolanda, PAR, Napoles, Thank]"
72,Philippines,The safety of detainees is an institutional concern of the government - Coloma on securing Napoles | via @aureacalica,1383876227.0,PhilippineStar,'398752704681758720',Hong Kong,,28800.0,,en,The safety of detainees is an institutional concern of the government - Coloma on securing Napoles | via @aureacalica,"[safety, detainees, institutional, concern, government, Coloma, securing, Napoles, |, @aureacalica]"
