,id,created_at,user,text,language,lat,lng,user location,user utc offset,user time zone,,lemmas
,'398212389079756800',1383747406.0,MirandaCruise,SUPER Typhoon will hit the country. KEEP SAFE everyone. #PrayForThePhilippines,en,14.512148199999999,121.00163422,,,,,"['super', 'typhoon', 'hit', 'country', 'safe', 'prayforthephilippine']"
,'398212430901542912',1383747416.0,YaFav__,"@ImSmokingLOUD_: Ima Lace Malayza L Wit Dust, Then She Gonna Be Looking Like Crackhead Yolanda lol im not smoking with u anyway so MANZ",en,41.50999517,-74.06119865,,,,,"['lace', 'malayza', 'wit', 'dust', 'gon', 'look', 'like', 'crackhead', 'yolanda', 'lol', 'smoke', 'manz']"
,'398212784850087936',1383747501.0,miaqlero,"Yolanda is here, just keep safe and calm everyone #TyphoonYolanda",en,14.82543335,120.87374878,japan,,,,"['yolanda', 'safe', 'calm', 'typhoonyolanda']"
,'398212824138137601',1383747510.0,DEANCarreon,@Arciagss @darleeengg @suuuperhuan @Brisbeyn May bagyo sa Friday. Magaaral pa ba tayo? Hahaha,tl,14.746763,121.04867658,CassandraAlexisGanitano's ,-28800.0,Pacific Time (US & Canada),,"['bagyo', 'friday', 'magaaral', 'tayo', 'hahaha']"
,'398213524603674625',1383747677.0,liz_beadles,"kala ko walang pasok ngaun un pala meron , antagal kasi ni bagyo e",tl,34.02093,-118.210755,de Filipinas,-32400.0,Alaska,,"['kala', 'walang', 'pasok', 'ngaun', 'pala', 'meron', 'antagal', 'kasi', 'bagyo']"
,'398213578945093633',1383747690.0,lormaigneee,the head of students teacher in our school is named after the typhoon yolanda ,en,14.36166755,120.93310359,mnl,28800.0,Beijing,,"['head', 'student', 'teacher', 'school', 'name', 'typhoon', 'yolanda']"
,'398213711971622913',1383747722.0,PotsKeeee,Anjan na ba si Yolanda? Wag na sana tumama sa Pinas,tl,14.49601,121.0376,Under your sheets,-28800.0,Pacific Time (US & Canada),,"['anjan', 'yolanda', 'wag', 'sana', 'tumama', 'pinas']"
,'398213840493477888',1383747752.0,iambruceli,Hope everything's okay back home.... #YolandaPH,en,3.10404466,101.64698155,"T: 3.1117209,101.6354857",28800.0,Hong Kong,,"['hope', 'okay', 'home', 'yolandaph']"
,'398214301837570048',1383747862.0,chitru_chichru,#YolandaPH,pt,10.31852157,123.90806082,"cebu city, philippines",28800.0,Taipei,,['yolandaph']
,'398214376970129408',1383747880.0,ThesaLabayani,"""@ANCALERTS: (1/4) Signal #1: Camarines Norte, Camarines Sur, Catanduanes, Albay, Sorsogon, Ticao Is., Burias Is. #YolandaPH"" #besafe #pray",id,17.95443,102.59078000000001,"Vientiane, Lao PDR",25200.0,Bangkok,,"['signal', 'camarines', 'norte', 'camarines', 'sur', 'catanduanes', 'albay', 'sorsogon', 'ticao', 'burias', 'yolandaph', 'besafe', 'pray']"
,'398214588711174144',1383747931.0,iamjustinrick,Wala na pong ulan pero walang pasok #YolandaPH,tl,13.61539349,123.24817449,PILIPINAS,28800.0,Beijing,,"['wala', 'pong', 'ulan', 'pero', 'walang', 'pasok', 'yolandaph']"
,'398214686660775936',1383747954.0,chitru_chichru,Gloomy morning in #Cebu City.  #YolandaPH http://t.co/xAh122NV2N,en,10.31852157,123.90806082,"cebu city, philippines",28800.0,Taipei,,"['gloomy', 'morning', 'cebu', 'city', 'yolandaph']"
,'398214829925609472',1383747988.0,therealradzel,"Wag nman masyadong malakas, friend naman tau dba #YolandaPH",tl,10.88372,123.4139,Philippines,28800.0,Kuala Lumpur,,"['wag', 'nman', 'masyadong', 'malakas', 'friend', 'naman', 'tau', 'dba', 'yolandaph']"
,'398214874527825920',1383747999.0,lalalaMeh,Kunta magbalik lng tag bagyo sa Pacific ocean...di eang gd adto iya. As in. Youre not welcome ,tl,11.63852056,122.33146242,Nebula Galaxy ,28800.0,Beijing,,"['kunta', 'magbalik', 'lng', 'tag', 'bagyo', 'pacific', 'ocean', 'eang', 'adto', 'iya', 'welcome']"
,'398214998561787904',1383748028.0,superyannah,"RT @ANCALERTS: Typhoon Yolanda at 822km east of Hinatuan, Surigao Del Sur, with max. winds of 215kph &amp; gustiness of up to 250kph #YolandaPH",en,13.61872229,123.21781198,Pilipinas,28800.0,Beijing,,"['typhoon', 'yolanda', 'east', 'hinatuan', 'surigao', 'del', 'sur', 'max', 'wind', '215kph', 'amp', 'gustiness', '250kph', 'yolandaph']"
,'398215043428282368',1383748039.0,FigliaDiAli,Classes are suspended in all levels here in #CDO  Be safe. #YolandaPH,en,8.4520689,124.62918199,In my world. ,28800.0,Hong Kong,,"['class', 'suspend', 'level', 'cdo', 'safe', 'yolandaph']"
,'398215077972561920',1383748047.0,superyannah,"RT @ANCALERTS: (1/4) Signal #1: Camarines Norte, Camarines Sur, Catanduanes, Albay, Sorsogon, Ticao Is., Burias Is. #YolandaPH",id,13.61872229,123.21781198,Pilipinas,28800.0,Beijing,,"['signal', 'camarines', 'norte', 'camarines', 'sur', 'catanduanes', 'albay', 'sorsogon', 'ticao', 'burias', 'yolandaph']"
,'398215096163250176',1383748052.0,AmakiAlistair,Wag muna sana matigas ang ulo dun sa mga tatamaan ng bagyo #YolandaPH,tl,-27.66377264,153.18363413,Brisbane ll Australia ,36000.0,Brisbane,,"['wag', 'muna', 'sana', 'matigas', 'ang', 'ulo', 'dun', 'mga', 'tatamaan', 'bagyo', 'yolandaph']"
,'398215118812495872',1383748057.0,maebubbles07,Lamig! May bagyo pa pala:( ingat po tayo madlang people:),tl,16.0287513,120.74243090000002,,-25200.0,Arizona,,"['lamig', 'bagyo', 'pala', 'ingat', 'tayo', 'madlang', 'people']"
,'398215373314486272',1383748118.0,FigliaDiAli,But government offices are not.  #YolandaPH,en,8.45205148,124.62913521,In my world. ,28800.0,Hong Kong,,"['government', 'office', 'yolandaph']"
,'398215686398300160',1383748192.0,meggieto0ot,"Oh, bedweather!! It could have been nicer if Yolanda's not with you. #pray #trust #believe &gt;&gt; #GOD ...... #YolandaPH #TaclobanCity",en,11.23512613,125.000805,Philippines  ,28800.0,Singapore,,"['bedweather', 'nice', 'yolanda', 'pray', 'trust', 'believe', 'gt;&gt', 'god', 'yolandaph', 'taclobancity']"
,'398215886735032320',1383748240.0,monixcalleja,Yolanda push pa please yung sure tlaga na walang pasok haha,tl,13.64737297,123.19296367,Philippines,-32400.0,Alaska,,"['yolanda', 'push', 'yung', 'sure', 'tlaga', 'walang', 'pasok', 'haha']"
,'398215922319515648',1383748249.0,dxsgeniuss,No classes today because of bagyong #YolandaPH,en,7.31579044,125.68791493,Follow,-25200.0,Arizona,,"['class', 'today', 'bagyong', 'yolandaph']"
,'398216053198573568',1383748280.0,MikoooTheGreat,"Paskwelahun paq tani ni mama. -_-"" gstu nia ko guru mpatay sa skwelahan. Bi ambot. Hambalan gani may bagyo! Mayu lang tumawag c lola.",tl,11.587003,122.7311188,,28800.0,Hong Kong,,"['paskwelahun', 'paq', 'tani', 'mama', 'gstu', 'nia', 'guru', 'mpatay', 'skwelahan', 'ambot', 'hambalan', 'gani', 'bagyo', 'mayu', 'lang', 'tumawag', 'lola']"
,'398216174963396608',1383748309.0,couchpotatoew,"Lain rba ning bagyo kay mapalong ang tubig. Nah, di sad ta mka libang ug tarung haha ",tl,8.50437096,124.6245493,Paris,-32400.0,Alaska,,"['lain', 'rba', 'bagyo', 'kay', 'mapalong', 'ang', 'tubig', 'nah', 'sad', 'mka', 'libang', 'tarung', 'haha']"
,'398216361295372288',1383748353.0,peculiarketchup,Hasula sad aning Typhoon uy. Kung way klase ah! Sayang akong giplanohan na outfit. Haaayshunimal :)))),tl,8.46857366,124.65444184,,-32400.0,Alaska,,"['hasula', 'sad', 'aning', 'typhoon', 'kung', 'way', 'klase', 'sayang', 'akong', 'giplanohan', 'outfit', 'haaayshunimal']"
,'398216402651213824',1383748363.0,riannaferatero,For all in the Visayas and other typhoon affected areas. God bless.We put our hope in the Lord.He is our help and our shield. - Ps 33:20,en,14.60623589,120.98966017,Mnl,,,,"['visayas', 'typhoon', 'affect', 'area', 'god', 'bles', 'hope', 'lord', 'help', 'shield', '33:20']"
,'398216468879245314',1383748379.0,loquacioushanie,Good morning..   hello YOLANDA. ,tl,8.239663799999999,124.2478962,manila philippines,-32400.0,Alaska,,"['good', 'morning', 'hello', 'yolanda']"
,'398216493906665473',1383748385.0,chorax_08,Lapit na si Yolanda. Need to cross to Batangas already.. :(,en,12.55083693,121.48256557,,,,,"['lapit', 'yolanda', 'need', 'cross', 'batangas']"
,'398216551792263168',1383748399.0,therealradzel,Let us all pray for the safety of our people. We just have to ask God and to believe him. #YolandaPH http://t.co/3rcyxPXaIN,en,10.88372,123.4139,Philippines,28800.0,Kuala Lumpur,,"['let', 'pray', 'safety', 'people', 'ask', 'god', 'believe', 'yolandaph']"
,'398216664686141441',1383748426.0,ralphalo,Calbayog: d pa naman umuulan medyo malamig ang hangin at makapal ang ulap. #YolandaPH keep safe everyone@YouScoop,tl,12.0705103,124.5664685,Philippines,-32400.0,Alaska,,"['calbayog', 'naman', 'umuulan', 'medyo', 'malamig', 'ang', 'hangin', 'makapal', 'ang', 'ulap', 'yolandaph', 'safe']"
,'398216672336945152',1383748427.0,iamIRAsistible,#cagayandeoro #yolandaph #suspensionofclasses @ One Tejada http://t.co/laH72XaBe8,id,8.478646699999999,124.67196354,Philippines,28800.0,Hong Kong,,"['cagayandeoro', 'yolandaph', 'suspensionofclass', 'tejada']"
,'398216726263123968',1383748440.0,gint0,Off to Visayas to welcome super typhoon Yolanda! @ NAIA Terminal 4 Departure Gate http://t.co/IsgMXo48eV,en,14.52488027,121.00106071,"Alabang, Philippines",28800.0,Hong Kong,,"['visayas', 'welcome', 'super', 'typhoon', 'yolanda', 'naia', 'terminal', 'departure', 'gate']"
,'398216801076936705',1383748458.0,illustriousjosh,@cRisly_belle: Keep safe dra ma @illustriousjosh !!! -- hey thanks ma!!! Scary typhoon Haiyan,en,10.33227179,123.90899045,Philippines,28800.0,Taipei,,"['safe', 'dra', 'hey', 'thank', 'scary', 'typhoon', 'haiyan']"
,'398216907947405312',1383748484.0,paoissuperhuman,"A recent aftershock and a super typhoon coming. Great, just great.",en,10.3367632,123.9070854,Philippines,28800.0,Hong Kong,,"['recent', 'aftershock', 'super', 'typhoon', 'come', 'great', 'great']"
,'398216955514994688',1383748495.0,MikoooTheGreat,Baw jusko. Tani tumalang lang ang bagyo. Ok nako sa no class. Ang bagyo nalang ipapalayua. Pls lord. Thanks,tl,11.5870046,122.73111829999999,,28800.0,Hong Kong,,"['baw', 'jusko', 'tani', 'tumalang', 'lang', 'ang', 'bagyo', 'nako', 'class', 'ang', 'bagyo', 'nalang', 'ipapalayua', 'pls', 'lord', 'thank']"
,'398217040403906560',1383748515.0,dfqseb,Maingay ang tl ko dahil sa bagyo. Imn Keep safe guys,tl,38.36954374,27.17711269,,28800.0,Beijing,,"['maingay', 'ang', 'dahil', 'bagyo', 'imn', 'safe', 'guy']"
,'398217100906360833',1383748530.0,asdfglydsss,Tagal naman ng bagyo,tl,13.9345073,121.4286135,Mars,-39600.0,International Date Line West,,"['tagal', 'naman', 'bagyo']"
,'398217140459012097',1383748539.0,kikayigat,DA maskin g.bagyo na tulog jpon akong manghud  HAHAHA  #noclass #bagyo #yolanda #keepsafe #cdo  http://t.co/K0ES8a5O6N,tl,8.4717937,124.64908247,"Shanghai,China",-28800.0,Pacific Time (US & Canada),,"['maskin', 'g.bagyo', 'tulog', 'jpon', 'akong', 'manghud', 'hahaha', 'noclass', 'bagyo', 'yolanda', 'keepsafe', 'cdo']"
,'398217269529948161',1383748570.0,goodvibesarchie,"""@ukgdos: (4/5) #YolandaPH SIGNAL NO. 1: Camiguin, Misamis Oriental, natitirang bahagi ng Agusan Del Norte...""",tl,14.627201300000001,121.05216090000002, MNL | ILO,28800.0,Hong Kong,,"['yolandaph', 'signal', 'camiguin', 'misamis', 'oriental', 'natitirang', 'bahagi', 'agusan', 'del', 'norte']"
,'398217306683097088',1383748579.0,goodvibesarchie,"""@ukgdos: (3/5) #YolandaPH SIGNAL NO. 1: Negros Oriental, Cebu, Camotes Island, Bohol, Siquijor, Leyte, Biliran Island, Northern Samar...""",tl,14.627201300000001,121.05216090000002, MNL | ILO,28800.0,Hong Kong,,"['yolandaph', 'signal', 'negros', 'oriental', 'cebu', 'camotes', 'island', 'bohol', 'siquijor', 'leyte', 'biliran', 'island', 'northern', 'samar']"
,'398217390560800769',1383748599.0,shairamaeee,No class today due to typhon Yolanda. Let us all pray for our safety. Ingat guys! God bless :),en,7.4599787,125.81943909999998,Philippines,-32400.0,Alaska,,"['class', 'today', 'typhon', 'yolanda', 'let', 'pray', 'safety', 'ingat', 'guy', 'god', 'bles']"
,'398217404947247104',1383748602.0,superyannah,maya maya pa daw si yolanda mag uunleash ng kanyang bitchyness,tl,13.61872229,123.21781198,Pilipinas,28800.0,Beijing,,"['maya', 'maya', 'daw', 'yolanda', 'mag', 'uunleash', 'kanyang', 'bitchyness']"
,'398217466800652288',1383748617.0,goodvibesarchie,"""@ukgdos: (1/5) #YolandaPH SIGNAL NO. 1: Camarines Norte, Camarines Sur, Catanduanes, Albay, Sorsogon, Ticao Island, Burias Island, Masbate""",id,14.627201300000001,121.05216090000002, MNL | ILO,28800.0,Hong Kong,,"['yolandaph', 'signal', 'camarines', 'norte', 'camarines', 'sur', 'catanduanes', 'albay', 'sorsogon', 'ticao', 'island', 'burias', 'island', 'masbate']"
,'398217846536146944',1383748707.0,saaayleng,"Yolanda huh, name of my Aunt lol",en,10.6974049,122.58577234,Iloilo City,-14400.0,La Paz,,"['yolanda', 'huh', 'aunt', 'lol']"
,'398218046327623680',1383748755.0,meybs29,May bagyo nanaman. Awww,tl,14.60256336,121.00267808,"Sampaloc, Manila",28800.0,Beijing,,"['bagyo', 'nanaman', 'awww']"
,'398218118054424576',1383748772.0,lalalubbsyew,Okay. So despite the super typhoon Yolanda we're still required to go to work. #supertyphoonproof,en,11.22522523,125.00399579999998,,-32400.0,Alaska,,"['okay', 'despite', 'super', 'typhoon', 'yolanda', 'require', 'work', 'supertyphoonproof']"
,'398218167949864960',1383748784.0,kuya_CJ,"""@aldenismyname: @kuya_CJ medyo okay lang"" dadaan ba kayo ng bagyo dyan",tl,10.4650129,122.8243775,Bacolod City,28800.0,Beijing,,"['medyo', 'okay', 'lang', 'dadaan', 'kayo', 'bagyo', 'dyan']"
,'398218281577754624',1383748811.0,couchpotatoew,@dilnarido: Zoraida daw ang next ngalan sa bagyo. Dili nlng unta na sya muabot uiq kulba ke mga ngalan sa bagyo gerd.,tl,8.50191245,124.62279693,Paris,-32400.0,Alaska,,"['zoraida', 'daw', 'ang', 'ngalan', 'bagyo', 'dili', 'nlng', 'unta', 'sya', 'muabot', 'uiq', 'kulba', 'mga', 'ngalan', 'bagyo', 'gerd']"
,'398218529880543232',1383748870.0,noelleorajay,@dost_pagasa dadaan b ng maynila ang  bagyong yolanda?,tl,14.63203745,121.04519882,,,,,"['dadaan', 'maynila', 'ang', 'bagyong', 'yolanda']"
,'398219019813003265',1383748987.0,WANNABEEwithyou,Good morning !!  sana di na dumating si Yolanda :))))),en,14.625060000000001,121.09723000000001,Philippines,-32400.0,Alaska,,"['good', 'morning', 'sana', 'dumat', 'yolanda']"
,'398219330514468864',1383749061.0,MikoooTheGreat,"""@MhiCDOnald: Best bagyo evah wala rain anu summer?""",tl,11.5870034,122.7311187,,28800.0,Hong Kong,,"['good', 'bagyo', 'evah', 'wala', 'rain', 'anu', 'summer']"
,'398219482851594241',1383749097.0,jeanoropesa,"""@trinket08: Cloudy morning tweeps .. Keep safe and sound .. #YolandaPH""",en,14.61222,121.10349,,-25200.0,Arizona,,"['cloudy', 'morning', 'tweep', 'safe', 'sound', 'yolandaph']"
,'398219642629812224',1383749136.0,Dominic_Rea,Super typhoon is coming to the Philippines.... #letspray @ Residencia de Regina http://t.co/1Ziq9goTYY,en,14.63448399,121.07247186,"Quezon City,Philippines",-32400.0,Alaska,,"['super', 'typhoon', 'come', 'philippines', 'letspray', 'residencia', 'regina']"
,'398219814071570432',1383749176.0,monixcalleja,Puta sinuspend baga klase all levels!!!! Pero ang panahon nakakaribong. May saldang baga. Hahahahahaha Yolanda naman oh please,tl,13.64737297,123.19296367,Philippines,-32400.0,Alaska,,"['puta', 'sinuspend', 'baga', 'klase', 'level', 'pero', 'ang', 'panahon', 'nakakaribong', 'saldang', 'baga', 'hahahahahaha', 'yolanda', 'naman']"
,'398219823622021120',1383749179.0,beiyalalala_,"Kag mai klase ya mga manghod ko biskan manog bagyo na. Keep them safe Papa Lord, even though their school is just 3blocks away. #YolandaPH",tl,10.62287508,122.93164326,,28800.0,Beijing,,"['kag', 'mai', 'klase', 'mga', 'manghod', 'biskan', 'manog', 'bagyo', 'safe', 'papa', 'lord', 'school', '3blocks', 'away', 'yolandaph']"
,'398219906484682753',1383749198.0,ridzkatheone,#YolandaPH is coming with much more intensity. Picking up speed reaching up to 250 kmh.. #besafe #cebuinterns #supertyphoon #scared,en,10.3037749,123.8910933,cebu city,,,,"['yolandaph', 'come', 'intensity', 'pick', 'speed', 'reach', 'kmh', 'besafe', 'cebuintern', 'supertyphoon', 'scar']"
,'398219940601532417',1383749207.0,kayceemaris,Ready to go.  #YolandaPH @ Ninoy Aquino International Airport (MNL) Terminal 3 http://t.co/tNiE75TX2s,en,14.52081866,121.01315975,"iphone:14.633513,121.002324",28800.0,Hong Kong,,"['ready', 'yolandaph', 'ninoy', 'aquino', 'international', 'airport', 'mnl', 'terminal']"
,'398219958833790976',1383749211.0,wilma723,yolanda may be strong but it is a bit slow. please dont touch my weekend. ,en,10.34251809,123.92809079,CEBU,-32400.0,Alaska,,"['yolanda', 'strong', 'bit', 'slow', 'not', 'touch', 'weekend']"
,'398220058654040064',1383749235.0,essaaaw,@madzsp nag decide nako now nga dili. dugay sad au cla mu txt oi. dko gusto maabtan bagyo sa syudad bcn d na nuon ko kauli. study nlng ko ,tl,8.45467766,124.61761876,Philippines,,,,"['nag', 'decide', 'nako', 'nga', 'dili', 'dugay', 'sad', 'cla', 'txt', 'dko', 'gusto', 'maabtan', 'bagyo', 'syudad', 'bcn', 'nuon', 'kauli', 'study', 'nlng']"
,'398220238153474048',1383749278.0,monixcalleja,Hay nako yolanda. Bitch please,tl,13.64737297,123.19296367,Philippines,-32400.0,Alaska,,"['hay', 'nako', 'yolanda', 'bitch']"
,'398220323885051904',1383749298.0,thisguysben,Di ko inexpect na serious pala 'tong si Yolanda oo. Pftt!,tl,10.31713,123.87773,CEB PH,28800.0,Beijing,,"['inexpect', 'pala', 'tong', 'yolanda', 'pftt']"
,'398220413710647297',1383749319.0,GeloAvendano,"Unang hirit vs huling idlip ah still so sleepy. Also, #YolandaPH please go away.",en,14.5845221,121.1408945,Philippines,28800.0,Hong Kong,,"['unang', 'hirit', 'hul', 'idlip', 'sleepy', 'yolandaph', 'away']"
,'398220922525855744',1383749441.0,ejfighter,Super typhoon Yolanda is coming! Let us pray and be safe Filipinos! @ Home http://t.co/jrv7dOy3m4,en,8.9844276,125.3595376,,,,,"['super', 'typhoon', 'yolanda', 'come', 'let', 'pray', 'safe', 'filipinos', 'home']"
,'398221670206275585',1383749619.0,handsomeoks,yolanda ampingi ako uyab hahh.. love kaay to nko,tl,10.820404400000001,123.86925430000001, cebu phil.,,,,"['yolanda', 'ampingi', 'ako', 'uyab', 'hahh', 'love', 'kaay', 'nko']"
,'398221783284715520',1383749646.0,anniemaezing,May bagyo pero super init dito sa albay.,tl,13.1396375,123.7341813,PH,-28800.0,Pacific Time (US & Canada),,"['bagyo', 'pero', 'super', 'init', 'dito', 'albay']"
,'398221978638635009',1383749693.0,jeffmangum,"@spann: Impressive look at Super Typhoon #Haiyan, nearing the Philippines http://t.co/rQekfe47Wf | Remarkable.",en,30.2977545,-97.7534015,"30.180959,-95.482096",-21600.0,Central Time (US & Canada),,"['impressive', 'look', 'super', 'typhoon', 'haiyan', 'near', 'philippines', 'remarkable']"
,'398222121630851072',1383749727.0,WotzenTiger,Goodmorning.. gloomy skies. #YolandaPH #bacolod,en,10.6823252,122.9547937,Bacolod City,28800.0,Hong Kong,,"['goodmorning', 'gloomy', 'sky', 'yolandaph', 'bacolod']"
,'398222307342045184',1383749771.0,ThesaLabayani,Updating and monitoring local news in my hometown. #Sorsogon #tunein #besafe #YolandaPH #prayforsafety http://t.co/DBig7z4pvl,en,17.9544,102.59075,"Vientiane, Lao PDR",25200.0,Bangkok,,"['updating', 'monitor', 'local', 'news', 'hometown', 'sorsogon', 'tunein', 'besafe', 'yolandaph', 'prayforsafety']"
,'398222353609392128',1383749782.0,DKiscRUEL,"INA, ilikay mo man po ang sakong mga tugang sa Bikol sa ano man na katibaadan na dara ni Yolanda.Oaut pa...",tl,14.549389999999999,121.05506000000001, MaKaT!,-39600.0,International Date Line West,,"['ina', 'ilikay', 'man', 'ang', 'sakong', 'mga', 'tugang', 'bikol', 'ano', 'man', 'katibaadan', 'dara', 'yolanda', 'oaut']"
,'398222434995671040',1383749801.0,WotzenTiger,@theembassadress u should hihi . Anu preparasyon moda para sa welcome party ni tita yolanda? #YolandaPH,tl,10.682322300000001,122.95472959999998,Bacolod City,28800.0,Hong Kong,,"['hihi', 'anu', 'preparasyon', 'moda', 'para', 'welcome', 'party', 'tita', 'yolanda', 'yolandaph']"
,'398222584984387585',1383749837.0,sergi_peich,"#QQCCMHFINAL por favor, castracin qumica para el friki y yolanda. Esos no pueden tener hijos.",es,40.43077586,-3.70730264,En todas partes,3600.0,Madrid,,"['qqccmhfinal', 'por', 'favor', 'castracin', 'qumica', 'para', 'friki', 'yolanda', 'esos', 'pueden', 'tener', 'hijos']"
,'398222798306680832',1383749888.0,Nando_Vegaa,E esse frio como faz? Hahaha #Boanoite @ Jardim Esther Yolanda http://t.co/Z73ukYG5x4,pt,-23.58147198,-46.76269691,Sao paulo,-7200.0,Brasilia,,"['esse', 'frio', 'como', 'faz', 'hahaha', 'boanoite', 'jardim', 'esther', 'yolanda']"
,'398223471114604545',1383750048.0,IrMolina07,@Ghietrosecom: Thanks Bagyong Yolanda. :),tl,11.56675317,122.73359684,RXS | ILO | ABRA,-32400.0,Alaska,,"['thank', 'bagyong', 'yolanda']"
,'398223511090511872',1383750058.0,HonraG,Parang Wala namang Bagyo eh. Di nga umuulan. May Araw pa.,tl,13.36525274,123.30816032,"Camarines Sur, Philippines ",28800.0,Beijing,,"['parang', 'wala', 'namang', 'bagyo', 'nga', 'umuulan', 'araw']"
,'398223755639410688',1383750116.0,danasaur_v,"@JimLibiran: Lord, iligtas mo po kami kay Yolanda habang pinaparusahan natin si Janet Napoles.",tl,14.59589272,120.99229698,Philippines,-32400.0,Alaska,,"['lord', 'iligtas', 'kami', 'kay', 'yolanda', 'habang', 'pinaparusahan', 'natin', 'janet', 'napoles']"
,'398224068261855232',1383750191.0,lalalubbsyew,RT @GaryValenciano1: i humbly yet boldly pray that You o Lord redirect the path of this typhoon to (cont) http://t.co/X0v8HTWtly,en,11.22522523,125.00399579999998,,-32400.0,Alaska,,"['humbly', 'boldly', 'pray', 'lord', 'redirect', 'path', 'typhoon', 'cont']"
,'398224397908975617',1383750269.0,pe1605,@jun_jun_r pedia in moalboal confirmed my suspicion of an ear infection. Southgen was shit.Thrilling pa flight coz of bagyo paet!,en,10.337346400000001,123.93147415,"adelaide, south australia",37800.0,Adelaide,,"['pedia', 'moalboal', 'confirm', 'suspicion', 'ear', 'infection', 'southgen', 'shit', 'thrilling', 'flight', 'coz', 'bagyo', 'paet']"
,'398224792966291456',1383750363.0,monixcalleja,Hayop ka yolanda sabing ipush mo pa,tl,13.64697063,123.1939537,Philippines,-32400.0,Alaska,,"['hayop', 'yolanda', 'sab', 'ipush']"
,'398224903062970368',1383750390.0,keithpareja,Pre-Yolanda habhab. @ Cebu Parklane International Hotel http://t.co/rMu3VxIEwO,de,10.320730000000001,123.90333116,"Cebu, Philippines",28800.0,Singapore,,"['pre', 'yolanda', 'habhab', 'cebu', 'parklane', 'international', 'hotel']"
,'398224942237380608',1383750399.0,XhycaSandalo,Nanginjan si Yolanda. Sigh,id,10.3174312,123.9073159,Philippines,-28800.0,Pacific Time (US & Canada),,"['nanginjan', 'yolanda', 'sigh']"
,'398225008800985088',1383750415.0,sheng_04,Mas malakas parin ang prayers kaysa sa kahit anong bagyo #PrayForThePhilippines  #YolandaPH,tl,14.53361442,121.02108546,,28800.0,Beijing,,"['mas', 'malakas', 'parin', 'ang', 'prayer', 'kaysa', 'kahit', 'anong', 'bagyo', 'prayforthephilippines', 'yolandaph']"
,'398225088111067136',1383750434.0,kimremos,Parang highschool. Di makabangon sa puyat. Kasalanan mo to Yolanda. Be safe everyone!,tl,14.53921795,121.01493931,Makati City,28800.0,Beijing,,"['parang', 'highschool', 'makabangon', 'puyat', 'kasalanan', 'yolanda', 'safe']"
,'398225090204028928',1383750434.0,shahirabrose,Ipang gawas mga jacket and long sleeves dihaaa. #YolandaPH,tl,8.23199889,124.24974599,PILIPINAS,-32400.0,Alaska,,"['ipang', 'gawa', 'mga', 'jacket', 'long', 'sleeve', 'dihaaa', 'yolandaph']"
,'398225186551382017',1383750457.0,lalalubbsyew,Napaabat na hi yolanda. It's starting to rain.,tl,11.22522523,125.00399579999998,,-32400.0,Alaska,,"['napaabat', 'yolanda', 'start', 'rain']"
,'398225208441835520',1383750463.0,sexychiic,@mypatatas walang bagyo nasa isip lang yun hehe ^^ mwaa kelangan ka dito yaps,tl,14.62548712,121.0520372,,-28800.0,Pacific Time (US & Canada),,"['walang', 'bagyo', 'nasa', 'isip', 'lang', 'yun', 'hehe', 'mwaa', 'kelangan', 'dito', 'yap']"
,'398225494312632321',1383750531.0,CallMeMeiLee,"#Philippines, don't just pray, be proactive &amp; prepare for the typhoon that's on its way there! Urrgghhh! This is #frustrating!",en,21.3255125,-157.80136299999998,United States of KathNiel,-36000.0,Hawaii,,"['philippine', 'not', 'pray', 'proactive', 'amp', 'prepare', 'typhoon', 'way', 'urrgghhh', 'frustrating']"
,'398225955526672386',1383750641.0,lalalubbsyew,Yolanda ma.land fall ha Leyte tom at 10am. Info via DZMM. #staysafe,tl,11.22522523,125.00399579999998,,-32400.0,Alaska,,"['yolanda', 'ma.land', 'fall', 'leyte', 'tom', 'info', 'dzmm', 'staysafe']"
,'398226081238368256',1383750671.0,monixcalleja,Puta grabeng pakipot ni Yolanda. Bitch please,tl,13.64737297,123.19296367,Philippines,-32400.0,Alaska,,"['puta', 'grabeng', 'pakipot', 'yolanda', 'bitch']"
,'398226200927023104',1383750699.0,lookslikemayet,Praying before going to sleep. I hope maskip ang bagyo sa negros kag guimaras haha http://t.co/wHJLEqprqx,tl,10.7333,122.97498333,"T: 10.7381,122.97352",28800.0,Kuala Lumpur,,"['pray', 'sleep', 'hope', 'maskip', 'ang', 'bagyo', 'negro', 'kag', 'guimara', 'haha']"
,'398226274776150017',1383750717.0,BabananaJason7,Hoy napoles pa bagyuhan ko na balay nyo linte kita may bagyo mga napoles man na ang inyo sa news ya,tl,10.61353215,122.96676162,"Bacolod City,Philippines",28800.0,Beijing,,"['hoy', 'napol', 'bagyuhan', 'balay', 'nyo', 'linte', 'kita', 'bagyo', 'mga', 'napoles', 'man', 'ang', 'inyo', 'news']"
,'398226353922658304',1383750736.0,gvelayo,"Severe Weather Bulletin 2Tropical cyclone warning: Typhoon #YolandaPH (HAIYAN)Issued at 5:00AM, 07 November... http://t.co/XgSX8Ll9TL",en,14.335131699999998,121.08540959999999,Binan Laguna,28800.0,Singapore,,"['severe', 'weather', 'bulletin', '2tropical', 'cyclone', 'warning', 'typhoon', 'yolandaph', 'haiyan)issu', '5:00am', 'november']"
,'398226496260538369',1383750770.0,rhon_pauL1990,Let's all pray that the country as well as our brothers and sisters will be safe on the incoming #YolandaPH super typhoon.,en,14.3993288,120.94130420000002,"Dasmarias, Cavite",28800.0,Singapore,,"['let', 'pray', 'country', 'brother', 'sister', 'safe', 'incoming', 'yolandaph', 'super', 'typhoon']"
,'398226586966556672',1383750791.0,itstrinarivera,Typhoon Yolanda's here.,en,10.53555652,124.0413767,city of lights x,-25200.0,Arizona,,"['typhoon', 'yolanda']"
