,id,created_at,user,text,language,lat,lng,user location,user utc offset,user time zone,,lemmas
,'398123931975950336',1383726316.0,kwinperez,"""@ANCALERTS: PAGASA: Typhoon Yolanda has entered PH Area of Responsibility as of 12am #YolandaPH""",en,14.55455,120.99955,,-32400.0,Alaska,,"['pagasa', 'typhoon', 'yolanda', 'enter', 'area', 'responsibility', 'yolandaph']"
,'398123943535472640',1383726319.0,dc_perp,@Sofiyadayada lol Yolanda is the name of my prof :)),en,14.49262085,121.00678101,,28800.0,Hong Kong,,"['lol', 'yolanda', 'prof']"
,'398124034027556865',1383726341.0,OhThatBrezine,A SUPER TYPHOON!,en,41.13420135,-95.95143087,"Bellevue, Nebraska",-21600.0,Central Time (US & Canada),,"['super', 'typhoon']"
,'398124588011241472',1383726473.0,youGEEz,May super typhoon. Ingat tayo.,tl,14.7071795,121.04522309999999,,-32400.0,Alaska,,"['super', 'typhoon', 'ingat', 'tayo']"
,'398124678671106048',1383726494.0,WotzenTiger,Laat goodnight. Totoo na to. Hahahaha #YolandaPH,tl,10.6823513,122.9547519,Bacolod City,28800.0,Hong Kong,,"['laat', 'goodnight', 'totoo', 'hahahaha', 'yolandaph']"
,'398124864407478272',1383726539.0,supiezajd,@kiraycelis ako rin alerto ang isip para sa bagyong Yolanda dito sa Bohol.Tuloy di maka tulog.:-(,tl,9.90781363,124.22415316,Philippines,,,,"['ako', 'rin', 'alerto', 'ang', 'isip', 'para', 'bagyong', 'yolanda', 'dito', 'bohol', 'tuloy', 'maka', 'tulog.:-']"
,'398124907587837952',1383726549.0,pharaohAMNHTP2,@ANCALERTS: PAGASA: Typhoon Yolanda has entered PH Area of Responsibility as of 12am #YolandaPH - Welcome Yolanda! Di mo kami matitinag!,en,14.38257276,120.99579759,Philippines,-28800.0,Pacific Time (US & Canada),,"['pagasa', 'typhoon', 'yolanda', 'enter', 'area', 'responsibility', 'yolandaph', 'welcome', 'yolanda', 'kami', 'matitinag']"
,'398125037359616000',1383726580.0,LernerGatchie,Si Yolanda Nakapasok Na,id,14.5720718,121.0073272,"Manila,Philippines",28800.0,Beijing,,"['yolanda', 'nakapasok']"
,'398125398015217664',1383726666.0,jayveelamano,@ANCALERTS: PAGASA: Typhoon Yolanda has entered PH Area of Responsibility as of 12am #YolandaPH,en,14.03872681,120.65284729,Philippines,28800.0,Hong Kong,,"['pagasa', 'typhoon', 'yolanda', 'enter', 'area', 'responsibility', 'yolandaph']"
,'398125550197170176',1383726702.0,carmzlopez,"Praying for fam and friends back in the Phils. Stay safe, y'all! #YolandaPH",en,27.67781886,85.31110136,On the Road,28800.0,Hong Kong,,"['pray', 'fam', 'friend', 'phils', 'stay', 'safe', 'yolandaph']"
,tl,,,"Lapu - Lapu City, Cebu, PH",28800.0,Beijing,Super typhoon Haiyan is closing in.,,,,,
,'398126256278880256',1383726870.0,XhycaSandalo,Yolanda!!,es,10.3174382,123.90729590000001,Philippines,-28800.0,Pacific Time (US & Canada),,['yolanda']
,'398126303036968960',1383726882.0,mylostprincess,"Dear kuya jess, please keep everyone safe from typhoon yolanda..",tl,14.65272672,121.12389564,i am the lost princess,-28800.0,Pacific Time (US & Canada),,"['dear', 'kuya', 'jess', 'safe', 'typhoon', 'yolanda']"
,'398126879195947008',1383727019.0,JohnEraCrz,Nakakatakot yung bagyo. Srsly.,tl,14.83827669,120.76898156,#Philippines,28800.0,Singapore,,"['nakakatakot', 'yung', 'bagyo', 'srsly']"
,'398126943293276161',1383727034.0,wandergel,May typhoon on Friday??? What nooo omg,en,14.50577008,121.00489337,"MNL, PH",-32400.0,Alaska,,"['typhoon', 'friday', 'nooo', 'omg']"
,'398127224312066049',1383727101.0,misstammyfelix,With my medicine loves.  (Before super typhoon Yolanda covers Mt. Mayon) @ Cagsawa Ruins http://t.co/cdJt5Ipem4,en,13.59040448,123.25319557,"MNL, Philippines ",28800.0,Hong Kong,,"['medicine', 'love', 'super', 'typhoon', 'yolanda', 'cover', 'mt.', 'mayon', 'cagsawa', 'ruins']"
,'398127308956893184',1383727121.0,djefferson777,Sana umalis kagad ung bagyo! Kasi Baka ma cancel ung flight namin sa Friday!,tl,14.59296736,120.97254724,"Springdale,Utah USA",28800.0,Beijing,,"['sana', 'umalis', 'kagad', 'ung', 'bagyo', 'kasi', 'baka', 'cancel', 'ung', 'flight', 'namin', 'friday']"
,'398127367035437056',1383727135.0,qwerchesterneil,Sana walang masyadong maging affected ng typhoon. Kawawa naman kasi yung mga hindi pa nakakarecover. #PrayForThePhilippines,tl,14.605329999999999,120.98885,"Manila, Philippines",28800.0,Beijing,,"['sana', 'walang', 'masyadong', 'maging', 'affect', 'typhoon', 'kawawa', 'naman', 'kasi', 'yung', 'mga', 'hindi', 'nakakarecover', 'prayforthephilippine']"
,'398127463743881216',1383727158.0,tinkerBelle_22,birthday celebration ni mother earth...haha let's celebrate bago dumating ang bagyo.. photo stolen http://t.co/FTpU6mfRpB,tl,10.32864811,123.90609314,"cebu,philippines",28800.0,Hong Kong,,"['birthday', 'celebration', 'mother', 'earth', 'haha', 'let', 'celebrate', 'bago', 'dumating', 'ang', 'bagyo', 'photo', 'steal']"
,'398127471742050304',1383727160.0,tinthepiggy,May bagyo na! Sana suspendend bukas. Wtf tin! ,tl,14.68640689,120.98732949,"Al-Khobar, KSA",-32400.0,Alaska,,"['bagyo', 'sana', 'suspendend', 'bukas', 'wtf', 'tin']"
,'398127624423092224',1383727197.0,supiezajd,Sinong gising pa ngayon dahil natatakot sa Bagyong Yolanda?Sabayan niyo naman ako.Tweet na! #YolandaPH,tl,9.90779755,124.22416977,Philippines,,,,"['sinong', 'gis', 'ngayon', 'dahil', 'natatakot', 'bagyong', 'yolanda?sabayan', 'niyo', 'naman', 'ako', 'tweet', 'yolandaph']"
,'398127755545427969',1383727228.0,qwerchesterneil,Super Yolanda has entered the Philippine Area of Responsibility as of 12 midnight. #PrayForThePhilippines,en,14.60645,120.98853999999999,"Manila, Philippines",28800.0,Beijing,,"['super', 'yolanda', 'enter', 'philippine', 'area', 'responsibility', 'midnight', 'prayforthephilippine']"
,'398127861732634624',1383727253.0,airanzer0,Wag sana tumuloy bagyo please  kakapalinis ko lng ng kotse ,tl,14.69580078,121.01416016,,-28800.0,Pacific Time (US & Canada),,"['wag', 'sana', 'tumuloy', 'bagyo', 'kakapalinis', 'lng', 'kotse']"
,'398127945082224640',1383727273.0,fastestnarvaez,"RT @bydebprice Typhoon headed to Philippines is classified as ""violent,"" with center winds of 195 km per hour. http://t.co/lBRbXwdC6B",en,32.92080222,-117.21693595,San Diego,-28800.0,Pacific Time (US & Canada),,"['typhoon', 'head', 'philippines', 'classify', 'violent', 'center', 'wind', 'hour']"
,'398128135222214656',1383727318.0,AlisteContreras,Deliks. Nasa PAR na si Yolanda.,tl,14.48907929,121.02958928,Filgaia ,28800.0,Hong Kong,,"['deliks', 'nasa', 'par', 'yolanda']"
,'398128147176361984',1383727321.0,supiezajd,Nawala na yung napakaraming bituin sa kalangitan.Naman ohh:-( #YolandaPH,tl,9.90781583,124.22415045,Philippines,,,,"['nawala', 'yung', 'napakaram', 'bituin', 'kalangitan', 'naman', 'ohh:-', 'yolandaph']"
,'398128199780954112',1383727334.0,iamJesmValencia,@UST_CSC: #YolandaPH has entered the PAR.Let us pray for everyone's safety!,en,14.66563628,121.07596769,"Quezon City, PH",-32400.0,Alaska,,"['yolandaph', 'enter', 'par.let', 'pray', 'safety']"
,'398128216788836353',1383727338.0,maLanDave,@UST_CSC: #YolandaPH has entered the PAR.Let us pray for everyone's safety!,en,14.59257081,121.02718343,,28800.0,Hong Kong,,"['yolandaph', 'enter', 'par.let', 'pray', 'safety']"
,'398128620876476416',1383727434.0,SoBelleLicious,It's a 5 way tie! Super Typhoon Haiyan is now tied as the strongest storm on the planet this year. 260kph/162mph #CNN http://t.co/4lFRk1ONas,en,10.33998006,123.91191101,"Queen City, PI",28800.0,Singapore,,"['way', 'tie', 'super', 'typhoon', 'haiyan', 'tie', 'strong', 'storm', 'planet', 'year', '260kph/162', 'mph', 'cnn']"
,'398128678841745408',1383727448.0,aperire19,"@ABSCBNNews: As of 12 am, Typhoon Yolanda has entered the Philippine Area of Responsibility (PAR) #YolandaPH ",en,14.70077646,121.06786001,DGP/ QC,36000.0,Guam,,"['typhoon', 'yolanda', 'enter', 'philippine', 'area', 'responsibility', 'par', 'yolandaph']"
,'398128989027332096',1383727522.0,jangsomera,@MariToniCabrera may bagyo na oy mag chuchubibo ka pa? Hahahaha!,tl,14.34248065,121.06767916,,28800.0,Beijing,,"['bagyo', 'mag', 'chuchubibo', 'hahahaha']"
,'398129065749925888',1383727540.0,StrykeLayos,Contingency plan. #meeting #yolandaPH @ NCR Cebu Development Center http://t.co/8TQPykZU5c,en,10.33286704,123.90764564,Philippines,28800.0,Singapore,,"['contingency', 'plan', 'meeting', 'yolandaph', 'ncr', 'cebu', 'development', 'center']"
,'398129240857530368',1383727582.0,bisdak_explorer,#Haiyan ( #YolandaPH ) has entered the Philippine Area of Responsibility. Signal #1 is advised for VisMin [pic]  https://t.co/rRRt3vYlk8,en,10.3057,123.87193,Cebu City,,,,"['haiyan', 'yolandaph', 'enter', 'philippine', 'area', 'responsibility', 'signal', 'advise', 'vismin', 'pic']"
,'398129425356558336',1383727626.0,salvimaris,"@tintwincities @caryldospueblos  wa man c yolanda, ngita gani ko  kay ako u aulod sa lata! Hahaha",tl,10.224701699999999,123.7639351,philippines,-32400.0,Alaska,,"['man', 'yolanda', 'ngita', 'gani', 'kay', 'ako', 'aulod', 'lata', 'hahaha']"
,'398129585448964096',1383727664.0,supiezajd,"""@lailing124: She's here! Spare us a liitle love and mercy, Yolly! Ayaw nagud kasuko, wa bitaw ka namo giunsa. #YolandaPH #pray""-mao jud",tl,9.90784228,124.22409064,Philippines,,,,"['spare', 'liitle', 'love', 'mercy', 'yolly', 'ayaw', 'nagud', 'kasuko', 'bitaw', 'namo', 'giunsa', 'yolandaph', 'pray', 'mao', 'jud']"
,'398129609314553856',1383727670.0,DoctorAdvice4u,Click On: http://t.co/20oKbDKsTX  : #PHILIPPINES:#SuperTyphoon #Haiyan(260 kph): Landfall Blog/Maps on site- #Visayas http://t.co/a3U0BHV0Tm,de,40.7312835,-74.1820555,"New Jersey & Texas, USA",-18000.0,Eastern Time (US & Canada),,"['click', 'philippines:#supertyphoon', 'haiyan(260', 'kph', 'landfall', 'blog', 'maps', 'site-', 'visayas']"
,'398129720333594624',1383727696.0,BonnieBurkert,"Today's earth &amp; space weather update: #Volcano, super #typhoon, X3.3 #solarflare thx @SOSpectObsrvR | http://t.co/YqMIpdqdf7",en,34.02093,-118.210755,Hollywood Hills,-28800.0,Pacific Time (US & Canada),,"['today', 'earth', 'amp', 'space', 'weather', 'update', 'volcano', 'super', 'typhoon', 'x3.3', 'solarflare', 'thx']"
,'398129856694607873',1383727729.0,mchX,This too shall pass #YolandaPH #sanahuminana,en,14.20946717,121.11187105,at the fairways...,28800.0,Taipei,,"['shall', 'pass', 'yolandaph', 'sanahuminana']"
,'398129976441974784',1383727757.0,JoPaoMarPog,"hi guys do you feel yolanda? tssss feelerts, hangin rna oy kay hpt naman ang pasko. hahaha",tl,7.05075908,125.56591197,,-18000.0,Quito,,"['guy', 'feel', 'yolanda', 'tssss', 'feelert', 'hangin', 'rna', 'kay', 'hpt', 'naman', 'ang', 'pasko', 'hahaha']"
,'398130118964428800',1383727791.0,supiezajd,Trust GOD to the fullest. #YolandaPH,en,9.90784228,124.22409064,Philippines,,,,"['trust', 'god', 'full', 'yolandaph']"
,'398130248291594240',1383727822.0,SoBelleLicious,Super Typhoon #Haiyan (all times local) Line indicates approximate time/location for center of storm#YolandaPH #CNN http://t.co/U0ITA2CleG,en,10.33998006,123.91191101,"Queen City, PI",28800.0,Singapore,,"['super', 'typhoon', 'haiyan', 'time', 'local', 'line', 'indicate', 'approximate', 'time', 'location', 'center', 'storm#yolandaph', 'cnn']"
,'398130259712688128',1383727825.0,erwincio,Ajajajaj y la ta Yolanda Zultana no estaba muerta!!! xDDDDDD,es,-36.73745265,-71.03529455,"Concepcion // Santiago, Chile",-18000.0,Quito,,"['ajajajaj', 'yolanda', 'zultana', 'estaba', 'muerta', 'xdddddd']"
,'398130409797476352',1383727861.0,Franciscaaaaaa,a yolanda sultana la dieron por muerta ajaj,es,-36.73745265,-71.03529455,Concepcion. Chile,-7200.0,Brasilia,,"['yolanda', 'sultana', 'dieron', 'por', 'muerta', 'ajaj']"
,'398130415250071553',1383727862.0,iamannemontano,OMYGEE ! Bagyong Yolanda is coming soon . Let's pray for everyone's safety . #philippines #YolandaPH,en,14.6020919,121.03085859999999,"san juan,manila",28800.0,Singapore,,"['omygee', 'bagyong', 'yolanda', 'come', 'soon', 'let', 'pray', 'safety', 'philippine', 'yolandaph']"
,'398130418199068672',1383727863.0,iamjackyvel,"Amen ""@keancipriano: Lets all pray na walang hassle na dalhin ang bagyo.""",tl,39.45945946,-0.35005726,Spain / Philippines,3600.0,Madrid,,"['amen', 'let', 'pray', 'walang', 'hassle', 'dalhin', 'ang', 'bagyo']"
,'398130621849292800',1383727911.0,iamjackyvel,"RT @ABSCBNNews: As of 12 am, Typhoon Yolanda has entered the Philippine Area of Responsibility (PAR) #YolandaPH",en,39.45945946,-0.35005726,Spain / Philippines,3600.0,Madrid,,"['typhoon', 'yolanda', 'enter', 'philippine', 'area', 'responsibility', 'par', 'yolandaph']"
,'398130649749389312',1383727918.0,ItsbobMali,Yolanda is now a category 4 storm and will eventually turn into a category 5 one within the next 24 hours. Wow,en,10.34187752,123.91414309999999,Philippines,28800.0,Hong Kong,,"['yolanda', 'category', 'storm', 'eventually', 'turn', 'category', 'hour', 'wow']"
,'398130869639979009',1383727970.0,AlyssaValdezA,"Lord God dont let super typhoon yolanda go around destroying many lives. please protect our people, amen. #PrayForThePhilippines",en,14.603716699999998,121.09971180000001,Philippines,28800.0,Beijing,,"['lord', 'god', 'not', 'let', 'super', 'typhoon', 'yolanda', 'destroy', 'life', 'protect', 'people', 'amen', 'prayforthephilippine']"
,'398130866804621312',1383727970.0,hahalimau,"""@matabangutak: Kung may Yolanda na bagyo. Ikaw YoLande.""",tl,9.74136,118.74185,phil.,,,,"['kung', 'yolanda', 'bagyo', 'ikaw', 'yolande']"
,'398130890892529665',1383727975.0,supiezajd,Its gonna be a worst day #YolandaPH,en,9.90778552,124.22400902,Philippines,,,,"['gon', 'bad', 'day', 'yolandaph']"
,'398131183760199680',1383728045.0,iamjackyvel,RT @ANCALERTS: PAGASA: Typhoon Yolanda has entered PH Area of Responsibility as of 12am #YolandaPH,en,39.45945946,-0.35005726,Spain / Philippines,3600.0,Madrid,,"['pagasa', 'typhoon', 'yolanda', 'enter', 'area', 'responsibility', 'yolandaph']"
,'398131336977735680',1383728082.0,ImFesay,Maygas andito na si Yolanda :'(,tl,14.663796300000001,121.0578881,Philippines  ,28800.0,Beijing,,"['maygas', 'andito', 'yolanda']"
,'398131713861484544',1383728172.0,allEduardo,Getting ready for TyphoonYolanda (Haiyan). Stay safe and dry everyone!  @clingesmeralda http://t.co/hLxbsotKZi,en,10.33073094,123.90576124,"Cebu City, Phils.",28800.0,Hong Kong,,"['get', 'ready', 'typhoonyolanda', 'haiyan', 'stay', 'safe', 'dry']"
,'398131743435554817',1383728179.0,medicroc,B careful of flash flooding. Last Monday's storm left the ground saturated. Dangerous flash flood potential #YolandaPH,en,42.17461332,-76.82647212,NYC,,,,"['careful', 'flash', 'flooding', 'monday', 'storm', 'leave', 'ground', 'saturate', 'dangerous', 'flash', 'flood', 'potential', 'yolandaph']"
,'398131867771088896',1383728208.0,alotzbella,Pls. be kind yolanda slowly naman. . God kw ng bahala. .  #YolandaPH,tl,10.3177924,123.9053492,"Cebu, Philippines",,,,"['pls', 'kind', 'yolanda', 'slowly', 'naman', 'god', 'bahala', 'yolandaph']"
,'398131879267667968',1383728211.0,ohohleebogz,Kala ko tapos na ko kay Yolanda. :((,tl,14.60576944,120.96718652,"Paris, France",28800.0,Singapore,,"['kala', 'tapo', 'kay', 'yolanda']"
,'398131961945804800',1383728231.0,MatthewRanada13,"Yolanda please, wag mo bahain ang Cainta Rizal. Ikaw kaya paglinisin ko ng putek, kaya mo? Tangina neetoo...",tl,14.566039000000002,121.02979309999999,Makati City/Cainta Rizal,28800.0,Kuala Lumpur,,"['yolanda', 'wag', 'bahain', 'ang', 'cainta', 'rizal', 'ikaw', 'kaya', 'paglinisin', 'putek', 'kaya', 'tangina', 'neetoo']"
,'398132009261735936',1383728242.0,iamfaty,Goodluck for the typhoon tomorrow,en,14.741677900000001,121.041133,MNL PHL,,,,"['goodluck', 'typhoon', 'tomorrow']"
,'398132159275220992',1383728278.0,belle_pascual,Ghaad! Keep safe and be ready sa province ko sa leyte.Typhoon yolanda entered the PH.Geez.,en,14.673590599999999,121.08171775,Philippines ,28800.0,Beijing,,"['ghaad', 'safe', 'ready', 'province', 'leyte', 'typhoon', 'yolanda', 'enter', 'ph.geez']"
,'398132240023957504',1383728297.0,Looking4alissa,Don't tell God how big your storm is. Tell him how big your God is. #yolandaph ,en,10.71072651,122.55735937,getting out of the rabbit hole,28800.0,Hong Kong,,"['not', 'tell', 'god', 'big', 'storm', 'tell', 'big', 'god', 'yolandaph']"
,'398132264271613952',1383728303.0,MIRABZmylabz,Mag #selfie sa ko mintras wa pa si jumegang Yolanda! K. GOODNIGHT. :) @ Mirabelle's Kingdom http://t.co/dO8QKqPz8Z,tl,10.398178,123.65343770000001,bluegreen planet  :D,-36000.0,Hawaii,,"['mag', 'selfie', 'mintras', 'jumegang', 'yolanda', 'goodnight', 'mirabelle', 'kingdom']"
,'398132359872004097',1383728326.0,kazuyaadesu,"Ooo, dakara my friends from Philipines told me, there's a typhoon at their place. Hope you guys will be fine.",en,4.6471324,101.20259855,In Your Soul,28800.0,Kuala Lumpur,,"['ooo', 'dakara', 'friend', 'philipines', 'tell', 'typhoon', 'place', 'hope', 'guy', 'fine']"
,'398132373889355776',1383728329.0,NoOtherNico,"For the love of God, please protect all of the people who will be affected by this storm. #YolandaPH",en,14.5486798,121.01241979999999,Makati City,28800.0,Beijing,,"['love', 'god', 'protect', 'people', 'affect', 'storm', 'yolandaph']"
,'398132516697034752',1383728363.0,sarahhmitchellx,it's awful Yolanda,en,42.56936066,-83.008157,cody,,,,"['awful', 'yolanda']"
,'398132584913195009',1383728379.0,Looking4alissa,Don't tell God how big your storm is. Tell the storm how big your God is. #yolandaph ,en,10.71072512,122.55735987,getting out of the rabbit hole,28800.0,Hong Kong,,"['not', 'tell', 'god', 'big', 'storm', 'tell', 'storm', 'big', 'god', 'yolandaph']"
,'398132684980899840',1383728403.0,NoOtherNico,"Basically as of this very moment, it is now the strongest storm that appeared worldwide this 2013. Please pray. #YolandaPH",en,14.5472481,121.01277340000001,Makati City,28800.0,Beijing,,"['basically', 'moment', 'strong', 'storm', 'appear', 'worldwide', 'pray', 'yolandaph']"
,'398132687472701441',1383728404.0,ooohhhDangdang,Pray for the Philippines #YolandaPH,en,40.87645442,-74.07918269,PHILIPPINES-NEW JERSEY,28800.0,Beijing,,"['pray', 'philippines', 'yolandaph']"
,'398132744275783680',1383728417.0,belle_pascual,Prayers #YolandaPH,tr,14.673590599999999,121.08171775,Philippines ,28800.0,Beijing,,"['prayer', 'yolandaph']"
,'398132762252955649',1383728422.0,budzcruz,akala ko ba may bagyo?! Arnold Clavio ba to' panira ng araw lol (@ Doa Paz Subdivision) http://t.co/bcv67pIpVV,tl,7.12213717,125.65875033,,-32400.0,Alaska,,"['akala', 'bagyo', 'arnold', 'clavio', 'panira', 'araw', 'lol', 'doa', 'paz', 'subdivision']"
,'398132912731607040',1383728458.0,pengwyyyne,Monster Typhoon. #Pray,en,10.29933476,123.88976133,"Cebu City, Philippines",-28800.0,Pacific Time (US & Canada),,"['monster', 'typhoon', 'pray']"
,'398132974366908416',1383728472.0,danasaur_v,"Pls Kuya that's scary haha miss you though! @CocoMarty: The night is so calm, it prepares for a wild typhoon coming.",en,14.595754999999999,120.99222812,Philippines,-32400.0,Alaska,,"['pls', 'kuya', 'scary', 'haha', 'mis', 'night', 'calm', 'prepare', 'wild', 'typhoon', 'come']"
,'398133239140737024',1383728535.0,JLhere,Good Night! Hoping and praying that this super typhoon will not affect anyone lalo na s Visayas Area na hindi pa nakakarecover! #PrayHard,en,14.68462668,120.98024158,"Valenzuela City, Philippines",-28800.0,Pacific Time (US & Canada),,"['good', 'night', 'hop', 'pray', 'super', 'typhoon', 'affect', 'lalo', 'visayas', 'area', 'hindi', 'nakakarecover', 'prayhard']"
,'398133310368411648',1383728552.0,arisa07,#YolandaPH has entered PAR. Let's pray for everyone's safety....,en,14.57070167,121.04940132,"Malolos, Bulacan",28800.0,Taipei,,"['yolandaph', 'enter', 'par', 'let', 'pray', 'safety']"
,'398133322729021440',1383728555.0,cr7jyej,We No Speak Americano by Yolanda Be Cool &amp; DCUP  https://t.co/vmZBq3n0sb,en,3.19612,101.7067,"Kuala Lumpur , Malaysia",28800.0,Kuala Lumpur,,"['speak', 'americano', 'yolanda', 'cool', 'amp', 'dcup']"
,'398133448335847424',1383728585.0,iamannemontano,"""@ramonbautista: omg nakakatakot yang mga forecast ng parating na bagyo parang end of the world levels""",tl,14.6020919,121.03085859999999,"san juan,manila",28800.0,Singapore,,"['omg', 'nakakatakot', 'yang', 'mga', 'forecast', 'parat', 'bagyo', 'parang', 'end', 'world', 'level']"
,'398133474982244352',1383728592.0,kopimonstah,@ANCALERTS: Aquino wants zero casualty in 'Yolanda' onslaught http://t.co/DiSDSvxE7O #YolandaPH -madaling magsalita.,en,14.686817900000001,121.1072051,"Manila, Philippines",28800.0,Hong Kong,,"['aquino', 'want', 'casualty', 'yolanda', 'onslaught', 'yolandaph', '-madal', 'magsalita']"
,'398133816956420096',1383728673.0,bno015,"""Girlie, malakas lakas ung bagyo! Lika, cuddle tayo. Baka lamigin ka."" #DaMoves #SoldierOfLove",tl,14.534882399999999,121.05227726,"T: 14.0700034,121.3237492",28800.0,Hong Kong,,"['girlie', 'malakas', 'lakas', 'ung', 'bagyo', 'lika', 'cuddle', 'tayo', 'baka', 'lamigin', 'damof', 'soldieroflove']"
,'398133872866516992',1383728686.0,supiezajd,Tweet the status of your place now! #YolandaPH,en,9.90778275,124.22408914,Philippines,,,,"['tweet', 'status', 'place', 'yolandaph']"
,'398133892890501120',1383728691.0,therealjeffen,Prayer is the BEST armor guys so lets keep the faith burning! #YolandaPh #SuperTyphoon #GodblessPhils. http://t.co/GgtaMC6BNq,en,8.4651064,124.64693503,"Cagayan de Oro City, Phils",,,,"['prayer', 'good', 'armor', 'guy', 'let', 'faith', 'burn', 'yolandaph', 'supertyphoon', 'godblessphils']"
,'398133919414890497',1383728698.0,LanzHenry,Pumasok nadaw sa PAR yung bagyo. Tsk. Stay safe everyone!,tl,13.12107963,123.74201299999999,Philippines,28800.0,Hong Kong,,"['pumasok', 'nadaw', 'par', 'yung', 'bagyo', 'tsk', 'stay', 'safe']"
,'398134010909437952',1383728719.0,vankrstn,Waiting for yolanda.,en,10.269474800000001,123.85170959999999,,28800.0,Hong Kong,,"['wait', 'yolanda']"
,'398134039946596352',1383728726.0,joannemarie06,Keep safe loves #yolandaPH,en,14.4210063,120.9970953,"Davao City, Philippines",28800.0,Singapore,,"['safe', 'love', 'yolandaph']"
,'398134095282065408',1383728739.0,trevdownlow,"Yolanda, Bayuhin mo nga si Clavio. Di nagaral yung lawyer na yun ng ilang taon para bastusin niya.",tl,14.665374499999999,120.9998137,"Manila, Philippines",28800.0,Beijing,,"['yolanda', 'bayuhin', 'nga', 'clavio', 'nagaral', 'yung', 'lawyer', 'yun', 'ilang', 'taon', 'para', 'bastusin', 'niya']"
,'398134330490249216',1383728796.0,NoOtherNico,"Shoutout to all my kabarangay living in southern tagalog, bicol and visayas to stay safe. @barangayginebra #YolandaPH",en,14.5472481,121.01277340000001,Makati City,28800.0,Beijing,,"['shoutout', 'kabarangay', 'live', 'southern', 'tagalog', 'bicol', 'visayas', 'stay', 'safe', 'yolandaph']"
,'398134583129939970',1383728856.0,goddessdianne_,"""@ramonbautista: omg nakakatakot yang mga forecast ng parating na bagyo parang end of the world levels""",tl,14.6799081,120.986585,,,,,"['omg', 'nakakatakot', 'yang', 'mga', 'forecast', 'parat', 'bagyo', 'parang', 'end', 'world', 'level']"
,'398134683201847296',1383728880.0,Jakifoxx,"""@ramonbautista: omg nakakatakot yang mga forecast ng parating na bagyo parang end of the world levels""",tl,14.407222899999999,121.0354268,New Jerusalem,-32400.0,Alaska,,"['omg', 'nakakatakot', 'yang', 'mga', 'forecast', 'parat', 'bagyo', 'parang', 'end', 'world', 'level']"
,'398134704043347968',1383728885.0,sharapar,Happy birthday dian nova yolanda art a.k.a oleett yang ke 40  (with Dian Nova),id,3.6290699999999996,98.68628000000001,Maldives,25200.0,Jakarta,,"['happy', 'birthday', 'dian', 'nova', 'yolanda', 'art', 'a.k.a', 'oleett', 'yang', 'dian', 'nova']"
,'398134717054083072',1383728888.0,karloVEVO,ENTER:YOLANDA,es,14.60640901,121.02374426,*,-28800.0,Pacific Time (US & Canada),,"['enter', 'yolanda']"
,'398134872335601664',1383728925.0,dndnsnts,"Dear Yolanda, huwag mo ng ituloy. Please lang.",tl,14.68644,121.05005220000001,"Quezon City, Philippines",28800.0,Singapore,,"['dear', 'yolanda', 'huwag', 'ituloy', 'lang']"
,'398135120152231937',1383728984.0,abdulraufmucsin,A welcome party for tita yolanda.nyahaha @WiYown @itsashleeora @Van_Dy1989 #friendsforlife #crazyfrog http://t.co/MIgtKBOAjy,en,8.48500006,124.65137243,philippines,-32400.0,Alaska,,"['welcome', 'party', 'tita', 'yolanda.nyahaha', 'friendsforlife', 'crazyfrog']"
,'398135500747194368',1383729075.0,montejo4life,I'm waiting for the Typhoon Yolanda what signal would it be here in Cebu City so I can sleep peacefully. So far no updates pa @dost_pagasa.,en,10.34877088,123.9515636,PH,28800.0,Hong Kong,,"['wait', 'typhoon', 'yolanda', 'signal', 'cebu', 'city', 'sleep', 'peacefully', 'far', 'update']"
,'398135777923563520',1383729141.0,supiezajd,There are still miracles.Don't lose hope....#YolandaPH,en,9.90788236,124.22417131,Philippines,,,,"['miracle', ""don't"", 'lose', 'hope', '#yolandaph']"
,'398135913600925697',1383729173.0,boybagtak,She's here. #YolandaPH,en,10.3077925,123.89637090000001,Cebu City,-32400.0,Alaska,,['yolandaph']
,'398136155667202048',1383729231.0,akiemownn,@ANCALERTS: Aquino wants zero casualty in 'Yolanda' onslaught http://t.co/90YkxX4KYv #YolandaPH lol PNoy try to call some storm stoppersXD,en,14.60948561,121.04748228,"New Manila, Quezon City",,,,"['aquino', 'want', 'casualty', 'yolanda', 'onslaught', 'yolandaph', 'lol', 'pnoy', 'try', 'storm', 'stoppersxd']"
,'398136493522173952',1383729311.0,shamaeeee,Sana hindi magtagal si Yolanda,tl,10.3504585,123.9553463,,-32400.0,Alaska,,"['sana', 'hindi', 'magtagal', 'yolanda']"
,'398136640595439616',1383729346.0,jinieboy,"Hoping na wag matuloy ang Yolanda na Bagyo sa Pinas, I pray na wag na lang tumuloy,",tl,0.0,0.0,Planet Earth,,,,"['hop', 'wag', 'matuloy', 'ang', 'yolanda', 'bagyo', 'pinas', 'pray', 'wag', 'lang', 'tumuloy']"
