,id,created_at,user,text,language,lat,lng,user location,user utc offset,user time zone,,lemmas
,'398261846945185792',1383759198.0,itsmephats,Hopefully humina Oh Lord ang Super Typhoon Yolanda.. please help us Oh Lord my Provinces Aklan&amp;Mindoro ..,en,11.7110623,122.3713284,Philippines,-32400.0,Alaska,,"['hopefully', 'humina', 'lord', 'ang', 'super', 'typhoon', 'yolanda', 'help', 'lord', 'province', 'aklan&amp;mindoro']"
,'398262231814508544',1383759290.0,Jamscey,Mapa High nalang ko para kadlawan ko ang bagyo kag makita ko si Poseidon sa ulan...,tl,10.70158658,122.56454682,Philippines ,-32400.0,Alaska,,"['mapa', 'high', 'nalang', 'para', 'kadlawan', 'ang', 'bagyo', 'kag', 'makita', 'poseidon', 'ulan']"
,'398262308729667584',1383759308.0,Vistuvious,YOLOnda nalang unta toh ila gi ngan sa typhoon. No sense of humor :\,tl,45.248224,-75.80014150000001,Las Vegas,-32400.0,Alaska,,"['yolonda', 'nalang', 'unta', 'toh', 'ila', 'ngan', 'typhoon', 'sense', 'humor']"
,'398262345991868416',1383759317.0,faufau196,"Lord God, paundanga na ang bagyo",tl,14.57847197,121.0783951,Cebu City,28800.0,Beijing,,"['lord', 'god', 'paundanga', 'ang', 'bagyo']"
,'398262546739654657',1383759365.0,soniatejapuspa,Gara2 kaset PS bajakan yang sering dimainin adik lagu ini jadi enakeun   Lo Gue End by Shella Yolanda  https://t.co/0Hpb7WsNwi,id,-6.90988,106.89952,indonesia,25200.0,Jakarta,,"['gara2', 'kaset', 'bajakan', 'yang', 'ser', 'dimainin', 'adik', 'lagu', 'ini', 'jadi', 'enakeun', 'gue', 'end', 'shella', 'yolanda']"
,'398262654470717440',1383759390.0,PinayTravelista,Breakfast in bed with TV blaring out with news of #PatrolPork &amp; #YolandaPH. #Staycation #Surigao #Mindanao #Travel... http://t.co/FqGtj8b9C1,en,9.788505,125.49670900000001,Philippines,28800.0,Singapore,,"['breakfast', 'bed', 'blare', 'news', 'patrolpork', 'amp', 'yolandaph', 'staycation', 'surigao', 'mindanao', 'travel']"
,'398262662418546689',1383759392.0,charievilla,"Super typhoon Haiyan hits Category 5, an extremely serious threat to Philippines http://t.co/OX0qePo9XI",en,14.49732251,121.01949448,"T: 14.602064,121.074641",28800.0,Hong Kong,,"['super', 'typhoon', 'haiyan', 'hit', 'category', 'extremely', 'threat', 'philippines']"
,'398262957949218817',1383759463.0,JohnAguisanda,"Yolanda my love, saan ka na? Kaytagal kitang hinintay. XD #bagyo",tl,10.74042939,122.53981021,Philippines,28800.0,Hong Kong,,"['yolanda', 'love', 'saan', 'kaytagal', 'kitang', 'hinintay', 'bagyo']"
,'398262996394188800',1383759472.0,blesseeey,bisan pag unsa ka kusog sa BAGYO wala gihapoy makalupig sa akong GUGMA kanimo. achichi.,tl,40.07304,-74.724323,,28800.0,Beijing,,"['bisan', 'pag', 'unsa', 'kusog', 'bagyo', 'wala', 'gihapoy', 'makalupig', 'akong', 'gugma', 'kanimo', 'achichi']"
,'398263027905998848',1383759479.0,OhTeej,She's definitely on her way! Keep dry everyone. Be alert. #YolandaPH,en,10.698739999999999,122.58783000000001,Philippines,,,,"['definitely', 'way', 'dry', 'alert', 'yolandaph']"
,'398263093676883968',1383759495.0,mardsib,"""@makipulido: Pag asa: Dahil mabilis ang takbo ng Bagyong Yolanda, agad ding lalabas ng PAR. Lalabas ito ng bansa sa linggo."" Ingatz!",tl,14.281117800000002,120.9966962,Philippines,28800.0,Singapore,,"['pag', 'asa', 'dahil', 'mabilis', 'ang', 'takbo', 'bagyong', 'yolanda', 'agad', 'lalabas', 'par', 'lalabas', 'ito', 'bansa', 'linggo', 'ingatz']"
,'398263096650641408',1383759496.0,meH_Hotmomz,Kakatapos nga lang ng LINDOL. TYPHOON YOLANDA na naman. Naku naman anu naba ang nangyari sa PILIPINAS?,tl,10.291976,123.86037240000002,cebu city,-28800.0,Pacific Time (US & Canada),,"['kakatapos', 'nga', 'lang', 'lindol', 'typhoon', 'yolanda', 'naman', 'naku', 'naman', 'anu', 'naba', 'ang', 'nangyari', 'pilipinas']"
,'398263109095133184',1383759499.0,chraysten,Our atmosphere here starts to darken and rain. #yolandaPh #Cebu,en,10.380061999999999,124.0029037,Philippines,28800.0,Hong Kong,,"['atmosphere', 'start', 'darken', 'rain', 'yolandaph', 'cebu']"
,'398263321465339904',1383759549.0,asdfghjkLianaD,"""naghahanda na nga so tito Ray kasi papunta na raw si Yolanda"" -papayawaaaaaa  dinamay mo pa si tita Yoli ",tl,34.10551985,-118.22815675,"Los Angeles, California",28800.0,Beijing,,"['naghahanda', 'nga', 'tito', 'ray', 'kasi', 'papunta', 'raw', 'yolanda', '-papayawaaaaaa', 'dinamay', 'tita', 'yoli']"
,'398263324015857664',1383759550.0,18Yllek,Its nice to be ready!!! #yolanda @ kelly's crib http://t.co/c7SV80piK0,en,10.334957800000002,123.9592236,,,,,"['nice', 'ready', 'yolanda', 'kelly', 'crib']"
,'398263885272072192',1383759684.0,ItsTrishB,"Prayers for Family, Friends &amp; CountryMen!  #YolandaPH http://t.co/8J398f10cq",en,14.45062849,121.02279568,N 14 30' 0'' / E 121 0' 0'',28800.0,Singapore,,"['prayer', 'family', 'friends', 'amp', 'countrymen', 'yolandaph']"
,'398263907564789760',1383759689.0,angeline0202,"@PhilippineStar @xelor58 NGCP Public Affairs Officer Elmer Cruz assures power transmission lines can withstand vs Yolanda,200MW supply ready",en,9.650929,123.85420811,"Tagbilaran City, Bohol",,,,"['ngcp', 'public', 'affairs', 'officer', 'elmer', 'cruz', 'assure', 'power', 'transmission', 'line', 'withstand', 'yolanda,200mw', 'supply', 'ready']"
,'398263941828063232',1383759697.0,Jamscey,"Horror story: may bagyo Continuation: nag pundo na ulan, ligo na kay maskwela ka wala nag declare si sister",tl,10.70117088,122.56435835,Philippines ,-32400.0,Alaska,,"['horror', 'story', 'bagyo', 'continuation', 'nag', 'pundo', 'ulan', 'ligo', 'kay', 'maskwela', 'wala', 'nag', 'declare', 'sister']"
,'398263991975178240',1383759709.0,medallamarielle,@5283Bellafuerte YOLO YOLANDA HAHAHAHAHA,tl,10.25032472,123.79153292,Philippines,-32400.0,Alaska,,"['yolo', 'yolanda', 'hahahahaha']"
,'398263993548038144',1383759710.0,YowPoy,YOLANDA MAHAL NA KTA SALAMAT PO ,tl,10.66426321,123.00265169,CITY OF SMILES ,28800.0,Beijing,,"['yolanda', 'mahal', 'kta', 'salamat']"
,'398264114813747200',1383759739.0,MaryHop3,Lakas maka-Dragon ball itong bagyo. Super Haiyan. Hope it's not as bad as they predict.,tl,6.91602857,122.06066012,,28800.0,Hong Kong,,"['lakas', 'maka', 'dragon', 'ball', 'itong', 'bagyo', 'super', 'haiyan', 'hope', 'bad', 'predict']"
,'398264187001901056',1383759756.0,SuperLAYAN,Mainit ! #YolandaPH,fr,13.29381,123.48403,"Polangui,albay.philippnes",-25200.0,Arizona,,"['mainit', 'yolandaph']"
,'398264416019283968',1383759810.0,meggieto0ot,"sir @atomaraullo! Watch out po sa fans niyo dito sa Tacloban City, madami na naghahanap sayo. Mas excited pa sila sayo kesa kay Yolanda!",tl,11.2348415,125.0010294,Philippines  ,28800.0,Singapore,,"['sir', 'watch', 'fan', 'niyo', 'dito', 'tacloban', 'city', 'madami', 'naghahanap', 'sayo', 'mas', 'excite', 'sila', 'sayo', 'kesa', 'kay', 'yolanda']"
,'398264543769821184',1383759841.0,geraldinemisa,"Goodmorning Sunshine! Yolanda please, lumihis ka na. God bless Everyone! :) (@ Maglaya and Misa's Home - @frisco) http://t.co/sj7Sx5JLCv",en,14.64172464,121.01630786,Quezon City ;),28800.0,Singapore,,"['goodmorn', 'sunshine', 'yolanda', 'lumihis', 'god', 'bles', 'maglaya', 'misa', 'home']"
,'398264628779954176',1383759861.0,junefrances07,Good morning! Weather not so good.. Slowly feeling the presence of Yolanda.  #supertyphoon http://t.co/3UcXdyOLug,en,11.02543749,124.60109688,"T: 14.6018397,121.046963",28800.0,Hong Kong,,"['good', 'morning', 'weather', 'good', 'slowly', 'feel', 'presence', 'yolanda', 'supertyphoon']"
,'398264975291998208',1383759944.0,adhitiateddy,Sarapan dulu dg 'cantik' di... (with Yolanda at Bank BTPN Wahidin)  https://t.co/sC2kuVmGyt,id,-6.1683900000000005,106.83896000000001,"Jakarta, Indonesia",25200.0,Bangkok,,"['sarapan', 'dulu', 'cantik', 'yolanda', 'bank', 'btpn', 'wahidin']"
,'398265360144957440',1383760035.0,chammyboy,My first #surfing lesson. No sighting of #yolanda here yet @ San Juan Surf Resort http://t.co/WFKBrJMQw8,en,16.65718255,120.320249,"T: 14.598329,121.040612",28800.0,Hong Kong,,"['surf', 'lesson', 'sighting', 'yolanda', 'san', 'juan', 'surf', 'resort']"
,'398265643549487104',1383760103.0,angeline0202,@PhilippineStar @xelor58 NGCP temporary transmission lines ready for quick power restoration in case of need when #YolandaPH hits Bohol,en,9.65079357,123.85407657,"Tagbilaran City, Bohol",,,,"['ngcp', 'temporary', 'transmission', 'line', 'ready', 'quick', 'power', 'restoration', 'case', 'need', 'yolandaph', 'hit', 'bohol']"
,'398265749128478720',1383760128.0,msEUNIverCE,Lasallepls. Bskn may bagyo may klase?!,tl,10.65988288,122.94801715,,-25200.0,Arizona,,"['lasallepls', 'bskn', 'bagyo', 'klase']"
,'398265789645479936',1383760138.0,nicostars,Yolanda Be Cool,en,10.25642013,123.80289097,"Cebu City, Philippines",-28800.0,Pacific Time (US & Canada),,"['yolanda', 'cool']"
,'398265929697476608',1383760171.0,nadenmie,Oh! YOLANDA,es,10.59633531,122.58321431,,28800.0,Beijing,,['yolanda']
,'398266004754558976',1383760189.0,joellvillamarin,Women of the moment: #Yolanda and #Napoles.,en,14.5222,121.14941,Rizal. QC. Makati. Manila.,,,,"['woman', 'moment', 'yolanda', 'napoles']"
,'398266272527294464',1383760253.0,Vinceezzzz,Daw gusto ko ya magpuli sbng:( gling bsi abutan ako sang bagyo:/,tl,10.69607305,122.55166431,,28800.0,Beijing,,"['daw', 'gusto', 'magpuli', 'sbng', 'bsi', 'abutan', 'ako', 'sing', 'bagyo:/']"
,'398266274846765058',1383760254.0,richellemabell,Day 5 in #Manila. Getting a facial today then going to SM Megamall then going to wait out this crazy typhoon suppose to be coming tom. #fb,en,14.47924843,120.99200337,"Kelowna, BC",-18000.0,Eastern Time (US & Canada),,"['day', 'manila', 'get', 'facial', 'today', 'megamall', 'wait', 'crazy', 'typhoon', 'suppose', 'come', 'tom']"
,'398266354740244480',1383760273.0,OnlyChristlynC,Bahala padung na si Yolanda.. Basta ako... SMILING japon. MwahahahaXD #instadaily #instagood http://t.co/nkML92u287,tl,10.30763595,124.02010918,WATTYLAND,-32400.0,Alaska,,"['bahala', 'padung', 'yolanda', 'basta', 'ako', 'smiling', 'japon', 'mwahahahaxd', 'instadaily', 'instagood']"
,'398266451397595136',1383760296.0,beiagscoste,Oh yolanda! Lumapit ka. Eme,tl,14.60378611,120.98664227,near earth ,28800.0,Hong Kong,,"['yolanda', 'lumapit', 'eme']"
,'398266454333595648',1383760296.0,Kikonel9,"Are you ready foooooorrrrr, a perfect stormmmm. #readyngready #YolandaPH",en,10.40275877,123.91850404,Mandaue City :),28800.0,Beijing,,"['ready', 'foooooorrrrr', 'perfect', 'stormmmm', 'readyngready', 'yolandaph']"
,'398266462306988034',1383760298.0,janmbriones,Pulled out from AM shift. #YolandaPH is coming! On our way to Dumaguete. Keep safe everyone. :),en,10.63594,122.931373,"Negros Island, Philippines",-21600.0,Monterrey,,"['pull', 'shift', 'yolandaph', 'come', 'way', 'dumaguete', 'safe']"
,'398267083269488640',1383760446.0,junisidro,Supertyphoon Haiyan Category 5 Typhoon seen to hit Philippines Friday morning. Stay alert &amp; safe. #YolandaPH http://t.co/pOJzuJNrc1,en,14.436735999999998,120.984101,"Manila, Philippines",28800.0,Hong Kong,,"['supertyphoon', 'haiyan', 'category', 'typhoon', 'see', 'hit', 'philippines', 'friday', 'morning', 'stay', 'alert', 'amp', 'safe', 'yolandaph']"
,'398267179360985088',1383760469.0,akinol,puro kay Napoles balita nasan kay #YolandaPH ?,tl,14.6932886,121.08403919999999,Las Islas Filipinas ,-32400.0,Alaska,,"['puro', 'kay', 'napoles', 'balita', 'nasan', 'kay', 'yolandaph']"
,'398267204300312577',1383760475.0,bidmegoodbye,"My prayer goes out to people in Phil, be safe! ""Super Typhoon Haiyan Rages Toward Philippines With Category 5 Winds - http://t.co/sCxmji033g",en,3.08108108,101.5882901,Malaysia,28800.0,Kuala Lumpur,,"['prayer', 'people', 'phil', 'safe', 'super', 'typhoon', 'haiyan', 'rages', 'philippines', 'category', 'winds']"
,'398267657939869696',1383760583.0,glenjuego,Lone Weatherman. #YolandaPH  @ PAGASA Main Office http://t.co/REZjzu9HWJ,en,14.64351055,121.04423497,"Manila, Philippines",28800.0,Beijing,,"['lone', 'weatherman', 'yolandaph', 'pagasa', 'main', 'office']"
,'398268006393843712',1383760666.0,asdfghjkLianaD,@JianEXE hahahaha pero bagyo sad lage,tl,34.1055465,-118.22810537,"Los Angeles, California",28800.0,Beijing,,"['hahahaha', 'pero', 'bagyo', 'sad', 'lage']"
,'398268034454134784',1383760673.0,CharoBaller,Yolanda is coming. Not a good sight. Be safe everyone. #prayforsafety @ Laguindingan International http://t.co/CfD9Pqre8P,en,8.60845679,124.45831342,Cebu,,,,"['yolanda', 'come', 'good', 'sight', 'safe', 'prayforsafety', 'laguindingan', 'international']"
,'398268290071412736',1383760734.0,thenewlei,People are lining up... Racks are almost empty... #yolandaPH (at Robinsons Supermarket)  https://t.co/0YPAejXi9Y,en,10.306980000000001,123.89567,"10.298476,123.897327",28800.0,Hong Kong,,"['people', 'line', 'rack', 'yolandaph', 'robinsons', 'supermarket']"
,'398269096963215360',1383760926.0,angeline0202,"@PhilippineStar hydropower dam in Ewon,Sevilla gradually opens gate so waterflow in natural course &amp; spare Loboc when #YolandaPH brings rain",en,9.65079357,123.85407657,"Tagbilaran City, Bohol",,,,"['hydropower', 'dam', 'ewon', 'sevilla', 'gradually', 'open', 'gate', 'waterflow', 'natural', 'course', 'amp', 'spare', 'loboc', 'yolandaph', 'bring', 'rain']"
,'398269257273712640',1383760965.0,COCOhernandez,Please go somewhere else this weekend!  #YolandaPH,en,14.57072648,121.02273629,"Makati, Philippines",28800.0,Hong Kong,,"['weekend', 'yolandaph']"
,'398269364346290176',1383760990.0,junisidro,"Strongest Storm on Earth in 2013 (280 kph): Super Typhoon Haiyan, Category 5 Hurricane, expected to http://t.co/bjKbWSvkvb",en,14.43985056,120.98189615,"Manila, Philippines",28800.0,Hong Kong,,"['strong', 'storm', 'earth', 'kph', 'super', 'typhoon', 'haiyan', 'category', 'hurricane', 'expect']"
,'398269420843192320',1383761004.0,kangshifunaicha,no class because of the typhoon. Stay safe ph tlist!,en,8.447736099999998,124.63499740000002,f4 | abby's  ela ,28800.0,Beijing,,"['class', 'typhoon', 'stay', 'safe', 'tlist']"
,'398269453764677632',1383761011.0,jericomariano,"Is it just me, or nobody seems to be prepping for #Typhoon #YolandaPH.Stack-up your shelves guys, http://t.co/ZugvXgUOqc",en,14.46614976,121.01616383,Philippines,10800.0,Riyadh,,"['prepp', 'typhoon', 'yolandaph.stack', 'shelf', 'guy']"
,'398269595892449281',1383761045.0,angeline0202,@PhilippineStar @PIABOHOL Loboc river cruise operation suspended today as #YolandaPH looms,en,9.65079357,123.85407657,"Tagbilaran City, Bohol",,,,"['loboc', 'river', 'cruise', 'operation', 'suspend', 'today', 'yolandaph', 'loom']"
,'398269797877551105',1383761093.0,Notn2blkbitches,Isn't she lovely this Typhoon Haiyan  http://t.co/NHmoSSL5dh,en,15.166329000000001,120.587232,Boracay/Rio/Frankfurt/Bangkok,,,,"['not', 'lovely', 'typhoon', 'haiyan']"
,'398270132209717249',1383761173.0,ThunderySkye,Whoa! That's NOT good!! =/ RT @SandhyaABC7: Winds are stronger now w/this category 5 super typhoon #Haiyan! http://t.co/IyT8N0prhC,en,37.6286684,-122.4143228,"San Bruno, CA  (S.F. Bay Area)",-28800.0,Pacific Time (US & Canada),,"['whoa', 'good', 'wind', 'strong', 'category', 'super', 'typhoon', 'haiyan']"
,'398270175650127872',1383761184.0,iKrisVOfficial,Maghahanap sana ako ng work ngaun. Pero dahil may bagyo daw. pass muna ako.. Next week na lang..,tl,14.75801293,121.05963548,Philippines,28800.0,Singapore,,"['maghahanap', 'sana', 'ako', 'work', 'ngaun', 'pero', 'dahil', 'bagyo', 'daw', 'pass', 'muna', 'ako', 'week', 'lang']"
,'398270296253153280',1383761212.0,jayjerjay,Alis yolanda!,ht,14.5665326,121.07788240000001,"Pasig City, Philippines",,,,"['alis', 'yolanda']"
,'398270903249014784',1383761357.0,kathryntisalona,"-- Si Yolanda lang yan Pilipinas. Corruption nga nilalabanin natin, bagyo pa kaya? #hindinatutulogangDiyos #PrayforPhilippines",tl,14.17672027,121.21737121,"Laguna, Philippines",,,,"['yolanda', 'lang', 'yan', 'pilipinas', 'corruption', 'nga', 'nilalabanin', 'natin', 'bagyo', 'kaya', 'hindinatutulogangdiyos', 'prayforphilippine']"
,'398270997091987457',1383761379.0,iambruceli,God keep everyone safe in visayas and mindanao. #YolandaPH,en,3.10755288,101.63608842,"T: 3.1117209,101.6354857",28800.0,Hong Kong,,"['god', 'safe', 'visayas', 'mindanao', 'yolandaph']"
,'398271002217439232',1383761381.0,iamALDZtitude,"""@ANCALERTS: #YolandaPH PAGASA: 'Yolanda' has strong, damaging winds http://t.co/ShhctRklyp"" Stay safe, everyone!",en,7.825862499999999,123.4299727,"Pagadian City, Philippines",28800.0,Taipei,,"['yolandaph', 'pagasa', 'yolanda', 'strong', 'damaging', 'wind', 'stay', 'safe']"
,'398271025361604608',1383761386.0,HansDeihl,Yolanda XD,tr,7.07882179,125.61758568,,28800.0,Beijing,,['yolanda']
,'398271065601753089',1383761396.0,Adam_Genato,2 storms today: Yolanda and Napoles. Who's fiercer and stronger? Which one will blow us away completely? stay tuned.,en,14.61615737,121.06144112,Manila,,,,"['storm', 'today', 'yolanda', 'napoles', 'fierce', 'strong', 'blow', 'away', 'completely', 'stay', 'tune']"
,'398271294258806785',1383761450.0,Qkinatics,Thank God di ko feel ang bagyo  Stay safe dear friends  (@ SM City Naga) http://t.co/y3pjd3kUZl,tl,13.6212968,123.19030881,,-32400.0,Alaska,,"['thank', 'god', 'feel', 'ang', 'bagyo', 'stay', 'safe', 'dear', 'friend', 'city', 'naga']"
,'398271377414701056',1383761470.0,tiu_olive,Sea vessels take refuge at Tacloban shores in anticipation of Yolanda onslaught. http://t.co/pgYwC8V0Sn,en,11.25240137,125.00392132,,,,,"['sea', 'vessel', 'refuge', 'tacloban', 'shore', 'anticipation', 'yolanda', 'onslaught']"
,'398271378912067584',1383761470.0,thecenagillon,Sobrang nakakatakot 'yung paparating na bagyo. Nakakakilabot. Srsly,tl,14.6531189,121.04640159999998,Republic of the Philippines,-32400.0,Alaska,,"['sobrang', 'nakakatakot', 'yung', 'paparat', 'bagyo', 'nakakakilabot', 'srsly']"
,'398271383999766528',1383761472.0,cacacarlala,Bagyo na lagaw pa jpn ah,tl,10.6735007,122.94981489999999,,-32400.0,Alaska,,"['bagyo', 'lagaw', 'jpn']"
,'398271446889160704',1383761487.0,TheJoanMari,enough of this Yolanda chuchu. Napoles na muna.,en,10.79697113,122.98209843,Philippines,28800.0,Hong Kong,,"['yolanda', 'chuchu', 'napole', 'muna']"
,'398271561297580032',1383761514.0,ealapay,Cramming like its the end of the world! Raaarrr #yolandaPh (@ Mary Kay Head Office) http://t.co/WAeSzJqYGJ,en,7.06769554,125.60743519,"Prosperidad, Agusan del Sur",28800.0,Kuala Lumpur,,"['cram', 'like', 'end', 'world', 'raaarrr', 'yolandaph', 'mary', 'kay', 'head', 'office']"
,'398271570944090113',1383761516.0,sandrafameyla,"latepost (with Yolanda, Aning, and 4 others) [pic]  https://t.co/XJbpeEudqX",en,0.5128900000000001,101.45758000000001,"T: 0.472717,101.412419",-28800.0,Pacific Time (US & Canada),,"['latepost', 'yolanda', 'aning', 'pic']"
,'398271593844985858',1383761522.0,Grepaldeo,Ingat na lang po yung mga pamilya natin sa probinsya. Yolanda plss sana lumihis kana.,tl,14.6226734,120.987844,"Philippines, Manila",-25200.0,Arizona,,"['ingat', 'lang', 'yung', 'mga', 'pamilya', 'natin', 'probinsya', 'yolanda', 'pls', 'sana', 'lumihis', 'kana']"
,'398271687352782848',1383761544.0,OhhhShasha,"""@SeanOfficial_TD: Let's pray for visayas #YolandaPH""",en,16.4140774,120.5954967,Paris,-36000.0,Hawaii,,"['let', 'pray', 'visayas', 'yolandaph']"
,'398271693031890946',1383761545.0,nikkomileS,waterproof kami! #rescueTeam #YolandaPh [pic]  https://t.co/Ny1D5I2hqA,vi,11.30231,124.6861,"T: 11.2993848,124.6813913",28800.0,Singapore,,"['waterproof', 'kami', 'rescueteam', 'yolandaph', 'pic']"
,'398271779040284672',1383761566.0,angeline0202,"@PhilippineStar @PIABOHOL NGCP choppers,transpo on standby lest #YolandaPH brings down transmission line &amp; roads become impassable",en,9.65079357,123.85407657,"Tagbilaran City, Bohol",,,,"['ngcp', 'chopper', 'transpo', 'standby', 'lest', 'yolandaph', 'bring', 'transmission', 'line', 'amp', 'road', 'impassable']"
,'398271893595516928',1383761593.0,yeserwincan,Nakatututok kami sa Super Typhoon Janet! (@ Cattleya Condominium) [pic]: http://t.co/BwbjS49aTP,pl,14.55266042,121.01622666,"Antipolo City, PH",28800.0,Singapore,,"['nakatututok', 'kami', 'super', 'typhoon', 'janet', 'cattleya', 'condominium', 'pic']"
,'398272102404337664',1383761643.0,theeeeiiii,#pray for the #philippines #YolandaPH God Bless!,en,6.49870963,124.86229455,DVO,-32400.0,Alaska,,"['pray', 'philippine', 'yolandaph', 'god', 'bless']"
,'398272149535744000',1383761654.0,DirekJoey,@mrfu_mayganon  Tanging katapat mo lang sa lakas ng dating ay Ang papasok na bagyong Yolanda!,tl,14.63394425,121.03698305,"Manila, Philippines",28800.0,Hong Kong,,"['tang', 'katapat', 'lang', 'lakas', 'date', 'ang', 'papasok', 'bagyong', 'yolanda']"
,'398272167516729344',1383761658.0,paolosanjuan,@heradaphneee oo hahhaa medyo supertyphoon sa cabinet at typhoon lang sa kama hahhaahahhahahahahahha,tl,13.6240747,123.19316459999999,Naga City,28800.0,Beijing,,"['hahhaa', 'medyo', 'supertyphoon', 'cabinet', 'typhoon', 'lang', 'kama', 'hahhaahahhahahahahahha']"
,'398272282138640384',1383761686.0,itsmhielsaga,Please pray for our country. May God bless us all.  #YolandaPH,en,14.54071168,121.01491353,"Makati, Philippines",-36000.0,Hawaii,,"['pray', 'country', 'god', 'bless', 'yolandaph']"
,'398272302376169473',1383761691.0,theeeeiiii,Piste nga #YolandaPH na. Kung mag kusog di daw kami matuloy buas #paniramoment,tl,6.49870963,124.86229455,DVO,-32400.0,Alaska,,"['piste', 'nga', 'yolandaph', 'kung', 'mag', 'kusog', 'daw', 'kami', 'matuloy', 'buas', 'paniramoment']"
,'398272358332370945',1383761704.0,jhavinuya,Lets pray (-/\-) #YolandaPH,ht,14.5536439,121.0985882,"Pasig City, NCR,  Philippines",28800.0,Hong Kong,,"['let', 'pray', 'yolandaph']"
,'398272357338320897',1383761704.0,theeeeiiii,"@QueenAshi: Yolanda, Aba naman! bumaha na, lumindol, nagkagera, tapos babaha ulit? Anong trip mo?! Paki explain! Labyu.",tl,6.49870695,124.86229482,DVO,-32400.0,Alaska,,"['yolanda', 'aba', 'naman', 'bumaha', 'lumindol', 'nagkagera', 'tapos', 'babaha', 'ulit', 'anong', 'trip', 'paki', 'explain', 'labyu']"
,'398272511088939008',1383761740.0,gotstylesDT,May spag. Fruit salad. Coffee jelly ngadi. HAHAAHA YUNG TOTOO BAGYO O PARTY? Hayys.,tl,11.2484101,125.00605300000001,Philippines,,,,"['spag', 'fruit', 'salad', 'coffee', 'jelly', 'ngadi', 'hahaaha', 'yung', 'totoo', 'bagyo', 'party', 'hayys']"
,'398272519473348608',1383761742.0,cjtena,Umiinit ulit! Wala na si Yolanda,tl,13.59458531,123.17901771,"Naga City, Philippines",-28800.0,Pacific Time (US & Canada),,"['umiinit', 'ulit', 'wala', 'yolanda']"
,'398272705230680064',1383761787.0,kuya_CJ,@yhatsy01 meron bagyo dito,tl,10.4650192,122.8243604,Bacolod City,28800.0,Beijing,,"['meron', 'bagyo', 'dito']"
,'398273073809346560',1383761875.0,imneilthegreat,Super typhoon #YolandaPH looks like the portal to hell! #scary,en,10.253841699999999,123.8424598,Cebu City,-28800.0,Pacific Time (US & Canada),,"['super', 'typhoon', 'yolandaph', 'look', 'like', 'portal', 'hell', 'scary']"
,'398273112879267841',1383761884.0,biliranisland,The BFP  disseminate information on precaution for typhoon in the coastal area Brgy. Sto. Nio. http://t.co/Wsj3SybYJY,en,11.56649886,124.40562793,"Biliran Island, Philippines",28800.0,Taipei,,"['bfp', 'disseminate', 'information', 'precaution', 'typhoon', 'coastal', 'area', 'brgy', 'sto', 'nio']"
,'398273126976724992',1383761887.0,junisidro,Strongest Storm on Earth in 2013 (280 kph). Stay alert and safe. #YolandaPH #Typhoon #Hurricane #Alert #Safe [pic]: http://t.co/uQIWZsEa95,en,14.43985056,120.98189615,"Manila, Philippines",28800.0,Hong Kong,,"['strong', 'storm', 'earth', 'kph', 'stay', 'alert', 'safe', 'yolandaph', 'typhoon', 'hurricane', 'alert', 'safe', 'pic']"
,'398273351447506944',1383761941.0,danaguro,Wearing short and slippers for office today in preparation for #YolandaPH  #praying #gettingready http://t.co/k06I98al6b,en,8.47293148,124.70890833,Philippines,28800.0,Taipei,,"['wear', 'short', 'slipper', 'office', 'today', 'preparation', 'yolandaph', 'pray', 'gettingready']"
,'398273441981161473',1383761962.0,istinecute17,"Lord, keep our families and friends in visayas region safe from typhoon.",en,14.52829859,121.01655053,makati city,,,,"['lord', 'family', 'friend', 'visayas', 'region', 'safe', 'typhoon']"
,'398273512000864256',1383761979.0,fishmarq,@elmitanyo saka ako ang tatalo kay yolanda. Ako ang magpapahina sa kanya. Hehe,tl,14.579702300000001,121.05597659999998,"Manila, Philippines",28800.0,Beijing,,"['saka', 'ako', 'ang', 'tatalo', 'kay', 'yolanda', 'ako', 'ang', 'magpapahina', 'kanya', 'hehe']"
,'398273591755538432',1383761998.0,Yv0nn3D33,"Panic Buying at Countrymall. The packer ask me: ""imnun ning C2?""  hehehe dili ui. usapon ko nah. hahaha Katawaa nya. nakarealize. #YolandaPH",tl,10.3398252,123.911427,Cebu city,-18000.0,Eastern Time (US & Canada),,"['panic', 'buy', 'countrymall', 'packer', 'ask', 'imnun', 'ning', 'hehehe', 'dili', 'usapon', 'nah', 'hahaha', 'katawaa', 'nya', 'nakarealize', 'yolandaph']"
,'398273756260343808',1383762037.0,chaarbaakii,"@QueenAshi: Yolanda, Aba naman! bumaha na, lumindol, nagkagera, tapos babaha ulit? Anong trip mo?! Paki explain! Labyu. Haha Tita Yols!! ",tl,10.2995439,123.86382481,"CEBU, PHILS",28800.0,Beijing,,"['yolanda', 'aba', 'naman', 'bumaha', 'lumindol', 'nagkagera', 'tapos', 'babaha', 'ulit', 'anong', 'trip', 'paki', 'explain', 'labyu', 'haha', 'tita', 'yols']"
,'398273851299069952',1383762060.0,paolosanjuan,@rizzaatoot hahahahaha wala dito lang sa bahay may bagyo e,tl,13.624074100000001,123.1931667,Naga City,28800.0,Beijing,,"['hahahahaha', 'wala', 'dito', 'lang', 'bahay', 'bagyo']"
,'398273968324362240',1383762088.0,FintonMusic,@thatbobfag the typhoons gone super haiyan,tl,42.96564753,-85.58860162,Michigan,-18000.0,Eastern Time (US & Canada),,"['typhoon', 'super', 'haiyan']"
,'398274024821633024',1383762101.0,haveaKEITHkat,Okay medyo boring di sa balay. Wala lang bagyo bla kay malagaw ko :(,tl,10.76880321,122.53391417,,-32400.0,Alaska,,"['okay', 'medyo', 'boring', 'balay', 'wala', 'lang', 'bagyo', 'bla', 'kay', 'malagaw']"
